count_location,ROAD_CLASS,TRAFFCTL,num_of_collisions,total_traffic,average_int_width,years,r
BATHURST ST AT COLLEGE ST (PX 300),Major Arterial,No Control,18,20083.944444444445,0.015,11,1.4881499190337932
JANE ST AT ST JOHNS RD (PX 523),Major Arterial,Traffic Signal,3,11620.0,0.015,11,0.42868503010440623
CHURCH ST AT GOULD ST (PX 993),Minor Arterial,Traffic Signal,10,9440.0,0.015,11,1.7589406955555087
CHARLES ST E AT CHURCH ST (PX 225),Minor Arterial,No Control,2,11585.0,0.015,11,0.28665343402751836
KING ST E AT PRINCESS ST,Major Arterial,No Control,11,5304.0,0.015,11,3.443597319503847
MOORE AVE AT MOUNT PLEASANT RD (PX 135),Major Arterial,Traffic Signal,3,21166.0,0.015,11,0.2353453675618067
QUEEN ST W AT UNIVERSITY AVE (PX 80),Major Arterial,Traffic Signal,17,21779.764705882353,0.015,11,1.2960415625909414
DUFFERIN ST AT ST CLAIR AVE W,Major Arterial,No Control,17,17770.29411764706,0.015,11,1.5884644393276008
COUGAR CRT AT LUELLA ST & MARKHAM RD (PX 990),Major Arterial,No Control,9,12479.0,0.015,11,1.1975286601041433
MURISON BLVD AT SHEPPARD AVE E,Major Arterial,Traffic Signal,2,8689.0,0.015,11,0.3821935819091725
EGLINTON AVE W AT RENFORTH DR (PX 926),Major Arterial,No Control,6,25597.666666666668,0.015,11,0.38920110295051896
ATOMIC AVE AT NORTH QUEEN ST,Minor Arterial,No Control,4,8296.0,0.015,11,0.8005978865016394
DUNDAS ST W AT HURON ST,Major Arterial,Traffic Signal,8,7769.0,0.015,11,1.7098108035571118
COLLEGE ST AT DOVERCOURT RD,Major Arterial,Traffic Signal,3,13578.0,0.015,11,0.36686699438895276
DUNDAS ST E AT SHERBOURNE ST (PX 258),Major Arterial,No Control,19,10705.21052631579,0.015,11,2.947009798446347
LANYARD RD AT WESTON RD (PX 1096),Major Arterial,Traffic Signal,9,16532.0,0.015,11,0.9039414559302928
LAWRENCE AVE W AT VARNA DR,Major Arterial,Traffic Signal,8,18765.0,0.015,11,0.7078880966072583
SHEPPARD AVE AT WESTON RD (PX 588),Major Arterial,Traffic Signal,7,19788.0,0.015,11,0.5873802363164948
JARVIS ST AT WELLESLEY ST E (PX 11),Major Arterial,Traffic Signal,6,16558.0,0.015,11,0.6016813685002054
REVCOE DR AT WILLOWDALE AVE,Minor Arterial,No Control,3,7952.0,0.015,11,0.6264235475117205
MCNICOLL AVE AT TAPSCOTT RD (PX 2043),Minor Arterial,No Control,3,10607.0,0.015,11,0.4696257235611578
HIGHVIEW AVE AT LEXFIELD AVE & WILSON AVE (PX 815),Major Arterial,Traffic Signal,5,16138.6,0.015,11,0.5144312445331071
CARRIER DR AT HIGHWAY 27 (PX 1159),Major Arterial,No Control,12,16988.0,0.015,11,1.172903237535484
BAY ST AT DUNDAS ST W,Major Arterial,No Control,10,14615.0,0.015,11,1.1361204355828944
HIGHWAY 401 S TCS AT MARKHAM RD (PX 970),Major Arterial,No Control,7,33685.28571428572,0.015,11,0.34504917710410055
BATHURST ST AT DUPONT ST (PX 305),Major Arterial,Traffic Signal,7,21593.571428571428,0.015,11,0.5382657590791943
DANFORTH AVE AT EAST LYNN AVE & WOODMOUNT AVE (PX 1281),Major Arterial,No Control,4,11402.0,0.015,11,0.5825083376966849
BERGAMOT AVE AT REXDALE BLVD (PX 718),Major Arterial,Traffic Signal,8,12727.25,0.015,11,1.043707017056725
ALLEN AVE AT QUEENS AVE,Local,Stop Sign,2,404.0,0.015,11,8.2200000822
ADELAIDE ST AT BAY ST (PX 62),Major Arterial,No Control,7,18080.0,0.015,11,0.6428694754552434
NORTH QUEEN ST AT VANSCO RD,Minor Arterial,No Control,8,8633.0,0.015,11,1.5386910845401602
LAWRENCE AVE E AT CURLEW DR & RAILSIDE RD E,Major Arterial,Traffic Signal,10,28779.0,0.015,11,0.5769623741632441
ST CLAIR AVE W AT KEELE ST & WESTON RD (PX 493),Major Arterial,No Control,16,23862.6875,0.015,11,1.1133297649592238
BLOOR ST AT CONCORD AVE,Major Arterial,No Control,3,9616.0,0.015,11,0.5180241316361481
DUNDAS ST W AT HIGH PARK AVE (PX 2207),Local,No Control,2,10369.0,0.015,11,0.3202700388859871
CHERRY ST AT FG GARDINER UNDERPASS,Major Arterial,No Control,4,13133.0,0.015,11,0.5057306073568568
KINGSTON RD AT MCCOWAN RD & CATHEDRAL BLUFFS DR (PX 149),Major Arterial,Traffic Signal,6,25265.0,0.015,11,0.39432575102419953
DUPONT ST AT SPADINA RD (PX 840),Major Arterial,Traffic Signal,10,20735.6,0.015,11,0.8007677697314766
ROGERS RD AT WESTON RD (PX 395),Major Arterial,Traffic Signal,16,24452.0,0.015,11,1.0864976388708656
JOHN GARLAND BLVD AT MARTIN GROVE RD (PX 1132),Major Arterial,Traffic Signal,7,12549.0,0.015,11,0.9262156439740858
ELLESMERE RD AT MCCOWAN RD,Major Arterial,Traffic Signal,18,33873.0,0.015,11,0.8823523248274202
YONGE ST AT WILSON AVE & YORK MILLS RD,Major Arterial,Traffic Signal,19,35115.0,0.015,11,0.8984297398685349
DUFFERIN ST AT GORDON ST (PX 2317),Minor Arterial,No Control,2,6911.0,0.015,11,0.48052091350149045
MCGLASHAN RD AT YONGE ST,Major Arterial,No Control,8,19771.375,0.015,11,0.6718561623981743
DUNDAS ST AT NEILSON DR & WEST MALL CRES (PX 883),Major Arterial,Traffic Signal,4,31866.25,0.015,11,0.20842615828400268
CHRISTIE ST AT DUPONT ST (PX 841),Major Arterial,Traffic Signal,4,15533.0,0.015,11,0.4275902959130625
KEELE ST AT GULLIVER RD & INGRAM DR (PX 592),Major Arterial,Traffic Signal,3,15739.666666666666,0.015,11,0.31648192781379536
DAVENPORT RD AT DUFFERIN ST (PX 388),Minor Arterial,No Control,15,18647.0,0.015,11,1.3356894003896607
CLAREMONT ST AT QUEEN ST W,Major Arterial,No Control,3,11031.0,0.015,11,0.4515746577656786
BONIS AVE AT CARDWELL AVE & KENNEDY RD (PX 1576),Major Arterial,Traffic Signal,7,21617.0,0.015,11,0.5376823849854652
EGLINTON AVE W AT MARLEE AVE,Major Arterial,Traffic Signal,6,15619.333333333334,0.015,11,0.6378402897878527
FINCH AVE E AT WARDEN AVE,Major Arterial,No Control,10,19592.0,0.015,11,0.8475091958985301
MOUNT ROYAL AVE AT REGAL RD,Local,Stop Sign,10,545.0,0.015,11,30.46678929549358
IDAGROVE GT AT SHEPPARD AVE E,Major Arterial,Traffic Signal,6,7187.0,0.015,11,1.3862028801483792
RIMROCK RD AT W R ALLEN RD (PX 1997),Major Arterial,Traffic Signal,5,23944.0,0.015,11,0.3467340495749249
ELLESMERE RD AT DORMINGTON DR & GANDER DR,Major Arterial,Traffic Signal,4,13956.0,0.015,11,0.4759071414744627
ADELAIDE ST W AT BATHURST ST,Major Arterial,No Control,5,18754.0,0.015,11,0.44268956398752274
ELANA DR AT FINCH AVE & YORK GATE BLVD (PX 1590),Major Arterial,No Control,7,26316.14285714286,0.015,11,0.4416711134046761
F G GARDINER EXPY W/B OFF RAMP AT KIPLING AVE (PX 1890),None,No Control,17,24299.0,0.015,11,1.1616725084272934
MOULD AVE AT ST CLAIR AVE W (PX 2024),Major Arterial,Traffic Signal,2,13111.0,0.015,11,0.25328960668208383
CARLAW AVE AT QUEEN ST E (PX 545),Minor Arterial,Traffic Signal,8,9806.0,0.015,11,1.354631871592413
BEECROFT RD AT SHEPPARD AVE (PX 1169),Major Arterial,Traffic Signal,3,23518.0,0.015,11,0.21180882939931972
DUFFERIN ST AT HALLAM ST (PX 607),Major Arterial,No Control,3,12476.0,0.015,11,0.39927220662176993
TAPSCOTT RD AT WASHBURN WAY & MALVERN TOWN CENTRE (PX 1708),Minor Arterial,Traffic Signal,5,6172.0,0.015,11,1.345139352401491
QUEEN ST W AT GLADSTONE AVE & SUDBURY ST,Major Arterial,Traffic Signal,4,10938.0,0.015,11,0.6072188760667033
BATHURST ST AT QUEEN ST W,Major Arterial,No Control,15,16617.4,0.015,11,1.4988265462145702
CARDELL AVE AT WESTON RD (PX 2067),Major Arterial,No Control,2,13500.0,0.015,11,0.24599111357102224
COSBURN AVE AT PAPE AVE (PX 669),Major Arterial,Traffic Signal,10,10145.0,0.015,11,1.6367077541689503
DON MILLS RD AT THE DONWAY N,Major Arterial,Traffic Signal,3,12167.0,0.015,11,0.40941234896138745
QUEEN ST W AT RYERSON AVE,Major Arterial,No Control,5,10248.0,0.015,11,0.8101288137218972
BLOOR ST W AT RESURRECTION RD,Major Arterial,Traffic Signal,3,13017.0,0.015,11,0.3826780402407007
BRIDLETOWNE CRCL N AT WARDEN AVE (PX 1263),Major Arterial,Traffic Signal,2,17143.0,0.015,11,0.19371638763394972
AVENUE RD AT LAWRENCE AVE W (PX 119),Major Arterial,Traffic Signal,7,29563.571428571428,0.015,11,0.39315548002423645
BRINLOOR BLVD AT KINGSTON RD,Major Arterial,Stop Sign,5,21006.0,0.015,11,0.3952299382567839
ALLIANCE AVE AT CLIFF ST AND HUMBER BLVD N,Collector,Pedestrian Crossover,6,5911.0,0.015,11,1.6854407206270345
JANE ST AT PRITCHARD AVE (PX 1571),Major Arterial,No Control,7,12087.0,0.015,11,0.9616182771763715
GENTIAN DR AT RENFORTH DR,Minor Arterial,No Control,2,7291.0,0.015,11,0.45547661955956664
GUNNS RD AT ST CLAIR AVE (PX 1404),Major Arterial,Traffic Signal,9,13666.777777777777,0.015,11,1.0934516088890043
NIAGARA ST AT QUEEN ST W,Major Arterial,Traffic Signal,4,11816.0,0.015,11,0.5620988546392689
EGLINTON AVE W AT SCARLETT RD (PX 784),Major Arterial,Traffic Signal,20,26825.6,0.015,11,1.2379518196084338
OCONNOR DR AT WOODBINE AVE (PX 446),Major Arterial,Traffic Signal,7,25910.428571428572,0.015,11,0.4485869496210329
BROOKHAVEN DR AT LAWRENCE AVE (PX 2108),Major Arterial,Traffic Signal,7,12521.0,0.015,11,0.9282868873277537
DAVENPORT RD AT FOUNDRY AVE,Minor Arterial,No Control,4,13618.0,0.015,11,0.4877192000600382
BEARE RD AT STEELES AVE E,Minor Arterial,No Control,3,10019.0,0.015,11,0.49718734901818545
BERGAMOT AVE AT ISLINGTON AVE (PX 715),Major Arterial,Traffic Signal,9,17257.0,0.015,11,0.8659651242649129
BATHURST ST AT GREENWIN VILLAGE RD (PX 1399),Collector,No Control,4,17528.5,0.015,11,0.37891206129546745
ISLINGTON AVE AT LEMSFORD RD & WESTHAMPTON DR,Local,Stop Sign,2,20786.0,0.015,11,0.15976522819247574
STEELES AVE E AT WARDEN AVE,Major Arterial,Traffic Signal,6,36148.333333333336,0.015,11,0.27560441052034856
BEECHBOROUGH AVE AT KEELE ST (PX 591),Major Arterial,Stop Sign,2,11411.0,0.015,11,0.29102445300226104
SHEPPARD AVE E AT VICTORIA PARK AVE,Major Arterial,Traffic Signal,12,29937.166666666668,0.015,11,0.6655700060433062
ALBION RD AT ISLINGTON AVE (PX 717),Major Arterial,Traffic Signal,20,27754.95,0.015,11,1.196500095733842
DORIS AVE AT NORTHTOWN WAY,Minor Arterial,No Control,2,7556.0,0.015,11,0.4395023866078349
FINCH AVE E AT KENNEDY RD (PX 1021),Major Arterial,Traffic Signal,9,28373.0,0.015,11,0.5266965125097665
PHARMACY AVE AT SHEPPARD AVE E,Major Arterial,No Control,7,19034.0,0.015,11,0.6106483196506673
COSENTINO DR AT MIDLAND AVE,Major Arterial,No Control,6,13564.0,0.015,11,0.7344913078462402
KING ST W AT STRACHAN AVE,Major Arterial,No Control,4,12231.0,0.015,11,0.5430267407748837
BERKELEY ST AND HAHN PL AT THE ESPLANADE,Collector,Traffic Signal,3,2267.0,0.015,11,2.197318063437671
CARLAW AVE AT GERRARD ST E (PX 372),Minor Arterial,Traffic Signal,15,12927.0,0.015,11,1.9267115532657233
ELLESMERE RD AT PARKWOODS VILLAGE DR & VICTORIA PARK AVE,Major Arterial,Traffic Signal,9,28942.333333333332,0.015,11,0.5163357071915281
STEELES AVE W AT STEINWAY BLVD,Major Arterial,No Control,8,16310.0,0.015,11,0.8144402288678848
ISLINGTON AVE AT STEELES AVE W,Major Arterial,No Control,17,29619.29411764706,0.015,11,0.9530098918007969
LAKE SHORE BLVD AT TENTH ST (PX 236),Major Arterial,Stop Sign,7,7848.0,0.015,11,1.4810244796420493
ANGLESEY BLVD AT ROYAL YORK RD,Minor Arterial,No Control,3,11171.0,0.015,11,0.4459153209035181
FLEET ST AT FORT YORK BLVD (PX 1918),Minor Arterial,Traffic Signal,2,7407.0,0.015,11,0.44834346337367365
STEELES AVE AT YONGE ST,Major Arterial,Traffic Signal,13,31064.0,0.015,11,0.6948789665161346
FINCH AVE AT NORFINCH DR & OAKDALE RD (PX 870),Major Arterial,Traffic Signal,10,34509.2,0.015,11,0.481158652360646
DUFFERIN ST AT FINCH AVE (PX 618),Major Arterial,Traffic Signal,12,36786.333333333336,0.015,11,0.5416489873753695
LAWRENCE AVE E AT VICTORIA PARK AVE,Major Arterial,No Control,8,37669.625,0.015,11,0.35263213087030204
YONGE ST AT SHAFTESBURY AVE,Major Arterial,Traffic Signal,4,9121.0,0.015,11,0.7281833205150313
BEECROFT RD AT NORTH YORK BLVD (PX 1978),Minor Arterial,Stop Sign,5,11628.0,0.015,11,0.71398349527193
BATHURST ST AT DEWLANE DR & ROCKFORD RD (PX 677),Major Arterial,No Control,5,20244.6,0.015,11,0.4100945478311254
ALEXANDER ST AT CHURCH ST (PX 1480),Minor Arterial,No Control,2,9282.0,0.015,11,0.35777634488351656
DUPLEX AVE AT EGLINTON AVE W,Major Arterial,No Control,9,8895.0,0.015,11,1.6800404889757843
FINCH AVE AT MORNINGSIDE AVE & STAINES RD (PX 2046),Local,No Control,8,11340.125,0.015,11,1.171373343136447
DUPONT ST AT SYMINGTON AVE (PX 845),Major Arterial,No Control,8,13023.375,0.015,11,1.0199752470335226
BATHURST ST AT LAWRENCE AVE (PX 423),Major Arterial,Traffic Signal,8,27720.25,0.015,11,0.4791991462138762
WEDGEWOOD DR AT YONGE ST,Major Arterial,Stop Sign,6,25384.0,0.015,11,0.392477154886007
DAVENPORT RD AT SPADINA RD,Minor Arterial,Traffic Signal,4,8319.0,0.015,11,0.798384429188316
HIGHWAY 401 N TCS AT YONGE ST (PX 639),Major Arterial,No Control,3,41758.333333333336,0.015,11,0.11928924485683179
JAMESON AVE AT SPRINGHURST AVE,Minor Arterial,Stop Sign,5,12157.0,0.015,11,0.6829151997221355
OVERLEA BLVD AT THORNCLIFFE PARK DR E,Major Arterial,Traffic Signal,10,18399.1,0.015,11,0.90245719443038
FINCH AVE AT HIGHWAY 400 W TCS (PX 1095),Major Arterial,Traffic Signal,14,39165.57142857143,0.015,11,0.5935355820061761
GRANDRAVINE DR AT KEELE ST (PX 633),Major Arterial,No Control,7,11578.0,0.015,11,1.0038936013327693
LUMSDEN AVE AT OAK PARK AVE,Minor Arterial,Stop Sign,3,5654.0,0.015,11,0.8810258312368591
DANFORTH AVE AT DONLANDS AVE (PX 347),Major Arterial,No Control,2,13112.0,0.015,11,0.25327028929292256
UNIVERSITY AVE AT WELLINGTON ST (PX 76),Major Arterial,No Control,18,17896.333333333332,0.015,11,1.6700583154209918
HOLLAND PARK AVE AT OAKWOOD AVE,Minor Arterial,Stop Sign,2,9205.0,0.015,11,0.3607691508102988
BASTION ST AT FLEET ST AND LAKE SHORE BLVD W (PX 299),Major Arterial,Traffic Signal,2,20860.0,0.015,11,0.1591984675555513
LAWRENCE AVE E AT MILDENHALL RD (PX 1949),Major Arterial,No Control,4,13954.0,0.015,11,0.47597535233034266
COLLEGE ST AT HAVELOCK ST,Major Arterial,Stop Sign,3,9020.0,0.015,11,0.5522527771411531
YONGE ST AT CHAPLIN CRES & DAVISVILLE AVE (PX 47),Major Arterial,No Control,8,20911.5,0.015,11,0.6352255999251705
BATHURST ST AT HARBORD ST (PX 303),Major Arterial,No Control,11,18910.18181818182,0.015,11,0.9658733246597909
SHEPPARD AVE AT YONGE ST (PX 125),Major Arterial,Traffic Signal,9,38538.11111111111,0.015,11,0.387770954999687
BATHURST ST AT STEELES AVE W,Major Arterial,No Control,13,37252.46153846154,0.015,11,0.5794441313246076
BLOOR ST W AT RUNNYMEDE RD,Major Arterial,No Control,11,12490.0,0.015,11,1.4623571002921059
FRONT ST AT YONGE ST,Major Arterial,No Control,12,13590.0,0.015,11,1.4661722000921855
CHARLES ST E AT YONGE ST,Major Arterial,Stop Sign,3,10401.0,0.015,11,0.47892703103674655
JANE ST AT WILSON AVE (PX 532),Major Arterial,Traffic Signal,17,28275.0,0.015,11,0.9983193733784193
BIRCHMOUNT RD AT BESWICK PARK CRT,Major Arterial,No Control,2,8915.0,0.015,11,0.37250477097126194
PARKVIEW AVE AT WILLOWDALE AVE,Minor Arterial,Stop Sign,7,5648.0,0.015,11,2.057910785451629
HUNTINGWOOD DR AT WARDEN AVE (PX 871),Major Arterial,No Control,19,21146.315789473683,0.015,11,1.491908123834408
CONSILIUM PL AT CORPORATE DR (PX 1501),Collector,Traffic Signal,7,9162.0,0.015,11,1.2686182183181405
STEELES AVE E AT HILLCROFT DR & STRAWBERRY HILLS DR,Collector,Stop Sign,6,12018.0,0.015,11,0.8289765434869696
DOVEHOUSE AVE AT KEELE ST (PX 1869),Major Arterial,Traffic Signal,4,14984.5,0.015,11,0.44324202118306255
CHISHOLM AVE AT DANFORTH AVE,Major Arterial,No Control,8,14059.0,0.015,11,0.9448410365484887
MARKHAM RD AT STEELES AVE E,Major Arterial,Traffic Signal,17,31397.058823529413,0.015,11,0.8990485523160124
AVENUE RD AND ST GERMAIN AVE,Major Arterial,No Control,2,15365.0,0.015,11,0.21613277144216078
INGLETON BLVD AT MIDDLEFIELD RD & PASSMORE AVE (PX 1685),Minor Arterial,Traffic Signal,4,11919.0,0.015,11,0.5572413848827588
BLOOR ST AT SALEM AVE,Major Arterial,No Control,4,8827.0,0.015,11,0.752436849033375
JANE ST AT LAWRENCE AVE (PX 430),Major Arterial,No Control,9,25412.555555555555,0.015,11,0.5880542048110794
DUNDAS ST W AT PALMERSTON AVE,Major Arterial,No Control,5,8139.0,0.015,11,1.020051613591596
ST CLAIR AVE W AT DEER PARK CRES & GRANITE PL,Major Arterial,No Control,5,12054.0,0.015,11,0.688750629087606
BATHURST ST AT KING ST W,Major Arterial,No Control,6,22459.0,0.015,11,0.4435923282259407
AVENUE RD AT DAVENPORT RD (PX 108),Major Arterial,No Control,10,30829.2,0.015,11,0.5385932870799114
LAWRENCE AVE E AT TOWNLEY AVE,Major Arterial,No Control,14,18246.571428571428,0.015,11,1.2740015472748794
ISLINGTON AVE AT LAKE SHORE BLVD & SEVENTH ST (PX 1325),Major Arterial,No Control,3,9552.0,0.015,11,0.5214949800893217
FINCH AVE AT NEILSON RD (PX 1587),Minor Arterial,Traffic Signal,7,13502.714285714286,0.015,11,0.8607958274380347
ALLINGHAM GDNS AT WILSON AVE (PX 1477),Major Arterial,No Control,8,13030.0,0.015,11,1.019456648721044
COLLEGE ST AT LANSDOWNE AVE (PX 831),Minor Arterial,Traffic Signal,13,13033.76923076923,0.015,11,1.6561379777155414
BATHURST ST AT WELLS ST (PX 1064),Major Arterial,No Control,6,13681.0,0.015,11,0.7282099334570866
MIDLAND AVE AT STEELES AVE E,Major Arterial,Traffic Signal,6,22872.0,0.015,11,0.4355823758143757
CHURCH ST AT GLOUCESTER ST (PX 2530),Minor Arterial,No Control,2,8678.0,0.015,11,0.38267804024070073
DANFORTH AVE AT MAIN ST,Major Arterial,Traffic Signal,6,17613.666666666668,0.015,11,0.5656198841596336
DUNDAS ST W AT STERLING RD (PX 2366),Minor Arterial,Stop Sign,8,14644.125,0.015,11,0.9070886879779573
DAVENPORT RD AT HURON ST,Minor Arterial,Stop Sign,1,6532.0,0.015,11,0.2542008598598286
BLOOR ST AT ISLINGTON AVE (PX 339),Major Arterial,No Control,11,26244.636363636364,0.015,11,0.6959456374086217
LAWTON BLVD AT WAMSLEY BLVD,Local,No Control,2,1231.0,0.015,11,2.6977092065059307
HIGHWAY 401 S TCS AT KENNEDY RD & WILLIAM KITCHEN RD (PX 920),Major Arterial,Traffic Signal,16,37319.4375,0.015,11,0.7118821194898879
DUNDAS ST E AT GEORGE ST,Major Arterial,No Control,8,9238.0,0.015,11,1.4379216424372379
KIPLING AVE AT RATHBURN RD (PX 727),Major Arterial,Stop Sign,6,17141.666666666668,0.015,11,0.5811943665314381
DAN LECKIE WAY AT FG GARDINER UNDERPASS,None,No Control,2,1234.0,0.015,11,2.6911507562470023
CLEVELAND ST AT DAVISVILLE AVE,Collector,Stop Sign,4,6125.0,0.015,11,1.0843689904355267
DANFORTH RD AT ST CLAIR AVE (PX 392),Major Arterial,Traffic Signal,9,19006.555555555555,0.015,11,0.7862529381380485
ST CLAIR AVE AT WARDEN AVE (PX 473),Major Arterial,Traffic Signal,7,27465.85714285714,0.015,11,0.4231828650304306
QUEEN ST E AT DAVIES AVE & EAST DON ROADWAY,Local,No Control,2,8198.0,0.015,11,0.40508417092081006
BROWNLOW AVE AT EGLINTON AVE E,Major Arterial,No Control,6,3957.0,0.015,11,2.517725574836088
QUEEN ST W AT SPADINA AVE,Major Arterial,No Control,19,15461.631578947368,0.015,11,2.040428925912321
ALLANFORD RD AT BIRCHMOUNT RD & SCARDEN AVE (PX 1357),Major Arterial,Traffic Signal,8,14854.0,0.015,11,0.8942722588417398
DIXON RD AT MARTIN GROVE RD,Major Arterial,Traffic Signal,16,30674.0,0.015,11,0.8661094172807721
BATHURST ST AT ANTIBES DR & DREWRY AVE (PX 676),Major Arterial,Traffic Signal,4,23829.25,0.015,11,0.27872300078339024
STEELES AVE E AT MORNINGSIDE AVE,Major Arterial,No Control,4,11560.0,0.015,11,0.5745467185482354
LAWRENCE AVE E AT RAILSIDE RD W & UNDERHILL DR,Major Arterial,No Control,22,33009.0,0.015,11,1.1066581951981824
LAKE CRES AT LAKE SHORE BLVD W,Major Arterial,No Control,7,6533.428571428572,0.015,11,1.7790169417417154
KING ST W AT TECUMSETH ST,Major Arterial,Traffic Signal,5,11823.0,0.015,11,0.7022075685546817
HEATH ST E AT YONGE ST,Major Arterial,No Control,3,8073.0,0.015,11,0.617034565813601
BRIMWOOD BLVD AT SANDHURST CIR W,Collector,Stop Sign,3,6013.0,0.015,11,0.8284250872797607
DUFFERIN ST AT DUNDAS ST W,Minor Arterial,Traffic Signal,8,15422.0,0.015,11,0.8613357627308521
DON VALLEY PKWY E TCS AT YORK MILLS RD (PX 756),Major Arterial,Traffic Signal,3,14622.666666666666,0.015,11,0.3406574302325067
ADELAIDE ST AT GEORGE ST (PX 1963),Major Arterial,Traffic Signal,2,10443.0,0.015,11,0.31800057772754964
COXWELL AVE AT DANFORTH AVE (PX 349),Major Arterial,Traffic Signal,10,16852.3,0.015,11,0.9852898515955687
CHURCH ST AT DUNDAS ST E,Major Arterial,Traffic Signal,3,10987.0,0.015,11,0.45338309363913726
ALLIANCE AVE AT JANE ST (PX 525),Major Arterial,No Control,12,14272.083333333334,0.015,11,1.3961017276795238
OCONNOR DR AT PAPE AVE (PX 442),Major Arterial,Traffic Signal,5,14919.6,0.015,11,0.5564626453136814
GREENWOOD AVE AT PLAINS RD,Collector,Stop Sign,5,3847.0,0.015,11,2.1580972401928777
MARKHAM RD AT TUXEDO CRT (PX 957),Major Arterial,Traffic Signal,6,25206.0,0.015,11,0.3952487542500357
ELM ST AT YONGE ST,Major Arterial,No Control,5,7078.0,0.015,11,1.172958474572196
NASSAU ST AT SPADINA AVE (PX 278),Major Arterial,No Control,5,8108.0,0.015,11,1.0239516629282193
BROADVIEW AVE AT ERINDALE AVE,Minor Arterial,No Control,2,6614.0,0.015,11,0.502098583793287
DOHME AVE AT O CONNOR DR (PX 1720),Major Arterial,Traffic Signal,4,12382.5,0.015,11,0.5363828036678862
DEWSON ST AT OSSINGTON AVE (PX 2431),Minor Arterial,Stop Sign,11,8890.0,0.015,11,2.0545377033350283
AVENUE RD AT EDMUND AVE (PX 173),Major Arterial,Traffic Signal,2,21984.0,0.015,11,0.15105895347565504
FRONT ST E AT SCOTT ST,Minor Arterial,No Control,3,5132.0,0.015,11,0.9706391367523773
KEEWATIN AVE AT MOUNT PLEASANT RD,Major Arterial,Stop Sign,3,12259.0,0.015,11,0.4063398360235909
KING ST W AT SPADINA AVE,Major Arterial,Traffic Signal,8,20874.5,0.015,11,0.6363515357414645
EGLINTON AVE AT GLEN CEDAR RD & OLD PARK RD (PX 101),Major Arterial,Traffic Signal,5,15615.2,0.015,11,0.5316742714164404
BROADVIEW AVE AT GERRARD ST E (PX 374),Minor Arterial,Traffic Signal,8,11831.0,0.015,11,1.1227723888796552
LANSDOWNE AVE AT LN 2 N SEAFORTH E LANSDOWNE,Minor Arterial,No Control,3,5704.0,0.015,11,0.8733029540345724
CARLINGVIEW DR AT DIXON RD (PX 536),Major Arterial,No Control,15,14977.0,0.015,11,1.662989934503973
DANFORTH AVE AT JONES AVE,Major Arterial,No Control,6,11719.0,0.015,11,0.8501271524555339
BLACK CREEK DR AT EGLINTON AVE W (PX 1422),Major Arterial,No Control,12,22684.0,0.015,11,0.8783847733756306
DUFFERIN ST AT QUEEN ST W,Major Arterial,Streetcar (Stop for),10,15814.6,0.015,11,1.0499412040800276
DUNDAS ST W AT KEELE ST (PX 188),Major Arterial,Traffic Signal,7,19081.85714285714,0.015,11,0.6091168186206465
BLACK CREEK DR AT HUMBER BLVD & WESTON RD (PX 577),Minor Arterial,No Control,3,21788.0,0.015,11,0.2286267693139894
EDITH DR AT ORCHARD VIEW BLVD,Collector,Stop Sign,5,2839.0,0.015,11,2.92433958542515
HARBORD ST AT MAJOR ST,Minor Arterial,No Control,2,10991.0,0.015,11,0.3021453947055591
MORNINGSIDE AVE AT SHEPPARD AVE E,Major Arterial,No Control,10,21449.0,0.015,11,0.7741340000020515
SNOWCREST AVE AT UNICORN AVE (WEST LEG),Local,Stop Sign,2,509.0,0.015,11,6.524322265636149
SIMCOE ST AT WELLINGTON ST (PX 264),Minor Arterial,Traffic Signal,3,9424.0,0.015,11,0.5285781037577675
DIXON RD AT GOLFWOOD HTS (PX 1354),Major Arterial,Traffic Signal,3,12464.0,0.015,11,0.3996566150363608
BATHURST ST AT MELGUND RD (PX 2503),Major Arterial,No Control,4,13815.0,0.015,11,0.48076439134401744
DANFORTH AVE AT ROYAL DR (PX 2455),Major Arterial,No Control,3,17970.0,0.015,11,0.2772020061109182
BAYLAWN DR AT BOARHILL DR & MIDLAND AVE (PX 1896),Major Arterial,No Control,2,11603.0,0.015,11,0.28620874198128077
MILNER AVE AT MORNINGSIDE AVE (PX 1584),Major Arterial,Traffic Signal,17,24627.882352941175,0.015,11,1.1461594577133323
DRIFTWOOD AVE AT JANE ST & MILO PARK GT (PX 1213),Major Arterial,Traffic Signal,5,16024.6,0.015,11,0.5180909403680592
CHARLES ST AT QUEENS PARK CR,Major Arterial,No Control,4,16321.0,0.015,11,0.40694565690935613
BAY MILLS BLVD AT BIRCHMOUNT RD & BONIS AVE (PX 1060),Major Arterial,Traffic Signal,11,17298.0,0.015,11,1.0558931773990288
LAWRENCE AVE W AT ROYAL YORK RD & THE WESTWAY (PX 780),Minor Arterial,Traffic Signal,10,15470.0,0.015,11,1.0733290346505495
DUNDAS ST W AT GRACE ST,Major Arterial,Traffic Signal,2,9436.0,0.015,11,0.3519372650708775
BROADVIEW AVE AT WITHROW AVE,Minor Arterial,No Control,5,5892.0,0.015,11,1.4090631505468436
CHICOUTIMI AVE AT LAWRENCE AVE,Major Arterial,No Control,2,13916.0,0.015,11,0.23863754190922684
BREMNER BLVD AT VAN DE WATER CRES EAST LEG (PX 1990),Minor Arterial,Traffic Signal,3,6096.0,0.015,11,0.8171456774627954
BROADVIEW AVE AT QUEEN ST E,Major Arterial,Traffic Signal,15,7604.6,0.015,11,3.2752018842629465
PARK LAWN RD AT PARK LAWN GARDINER W RAMP (PX 1055),None,No Control,2,13552.0,0.015,11,0.24504722795224326
PLAXTON DR AT ST CLAIR AVE (PX 1681),Major Arterial,No Control,6,12219.0,0.015,11,0.8153400523468698
EGLINTON AVE W AT RICHARDSON AVE (PX 466),Major Arterial,No Control,3,13309.0,0.015,11,0.3742820685110227
GRANDRAVINE DR AT JANE ST (PX 962),Major Arterial,Traffic Signal,11,14938.0,0.015,11,1.2227098796792342
SHEPPARD AVE E AT TWYN RIVERS DR,Collector,No Control,7,8238.714285714286,0.015,11,1.4107881051761824
LAWRENCE AVE E AT VALPARAISO AVE (PX 2543),Major Arterial,No Control,5,19765.0,0.015,11,0.4200455392371364
EVANS AVE AT ISLINGTON AVE (PX 775),None,No Control,21,17478.571428571428,0.015,11,1.9949708413636846
STEELES AVE E AT TOWNSEND RD,Major Arterial,Traffic Signal,4,25639.0,0.015,11,0.25904910746977655
ROGERS RD AT SILVERTHORN AVE (PX 801),Minor Arterial,No Control,8,10752.0,0.015,11,1.2354464409258932
DON MILLS RD AT GATEWAY BLVD S & OVERLEA BLVD,Major Arterial,No Control,8,28916.0,0.015,11,0.4593830451250242
BISHOP AVE AT KENNETH AVE,Collector,No Control,2,6470.0,0.015,11,0.5132735754573107
BAYVIEW AVE AT MCKEE AVE (PX 1118),Major Arterial,No Control,9,19572.0,0.015,11,0.7635377145636421
EGLINTON AVE E AT MIDLAND AVE,Major Arterial,Traffic Signal,10,13458.1,0.015,11,1.2337848705273404
FIRGROVE S CRES AT JANE ST & YORKWOODS GT (PX 933),Major Arterial,No Control,3,14032.0,0.015,11,0.35499715292283357
KIPLING AVE AT MARKBROOK LANE,Major Arterial,No Control,3,6859.0,0.015,11,0.7262458156893425
BATHURST ST AT REINER RD,Major Arterial,Stop Sign,9,16756.555555555555,0.015,11,0.8918276849853553
BATHURST ST AT BURTON RD & STRATHEARN RD (PX 308),Major Arterial,No Control,2,19701.0,0.015,11,0.1685640339682656
CARLAW AVE AT LAKE SHORE BLVD E (PX 207),Major Arterial,Traffic Signal,13,32235.30769230769,0.015,11,0.6696297247073649
