count_location,ROAD_CLASS,TRAFFCTL,num_of_collisions,total_traffic,average_int_width,years,r
KEELE ST AT TILBURY DR (PX 598),Major Arterial,Traffic Signal,3,20262.0,0.015,11,0.2458454273918271
FERNCREST GT AT  VICTORIA PARK AV & VAN HORNE AV (PX 994),Collector,Stop Sign,4,18317.0,0.015,11,0.3626008662126768
BATHURST ST AT NIAGARA ST (PX 2363),Major Arterial,Traffic Signal,11,11872.90909090909,0.015,11,1.5383626744546979
NORTH QUEEN ST AT THE QUEENSWAY (PX 917),Major Arterial,Traffic Signal,7,26126.0,0.015,11,0.4448855590687744
ELLESMERE RD AT PRINCIPAL RD,Major Arterial,Traffic Signal,5,20900.0,0.015,11,0.39723445373311006
JAMES FINLAY WAY AT WILSON AVE (PX 2281),Major Arterial,Traffic Signal,3,18971.0,0.015,11,0.26257551261468565
HUNTINGWOOD DR & OLD SHEPPARD AVE AT VICTORIA PARK AVE (PX 1085),Major Arterial,No Control,9,12871.666666666666,0.015,11,1.1609965155592077
BYWOOD DR AT KIPLING AVE,Major Arterial,No Control,2,12598.0,0.015,11,0.26360374926248614
MASSIE ST AT SHEPPARD AVE E,Major Arterial,No Control,4,12533.0,0.015,11,0.5299417590694646
HORNER AVE AT THIRTIETH ST (PX 1018),Minor Arterial,Traffic Signal,7,7202.0,0.015,11,1.6138683860359349
BATHURST ST AT BAYCREST AVE (PX 981),Major Arterial,Stop Sign,6,18660.0,0.015,11,0.5339035423165274
STRATHMORE BLVD AT WOODBINE AVE,Major Arterial,No Control,2,8148.0,0.015,11,0.40756995989307815
GOODWILL AVE AT WILSON HEIGHTS BLVD,None,No Control,2,7939.0,0.015,11,0.41829953812933623
FINCH AVE E AT SCOTTFIELD DR & TIFFIELD RD,Local,No Control,3,12474.0,0.015,11,0.39933622332958163
LAWRENCE AVE W AT MARLEE AVE,Major Arterial,Traffic Signal,8,19931.0,0.015,11,0.666475346587487
QUEEN ST W AT STRACHAN AVE,Major Arterial,Traffic Signal,2,11443.0,0.015,11,0.2902106120081098
ADELAIDE ST W AT TECUMSETH ST,Collector,No Control,2,4111.0,0.015,11,0.8078034622254441
DUNDAS ST AT POPLAR AVE & SUBWAY CRES (PX 779),Major Arterial,Traffic Signal,2,24572.0,0.015,11,0.13514895137590757
FALLINGBROOK RD AT KINGSTON RD,Major Arterial,Traffic Signal,5,12981.0,0.015,11,0.6395655252308761
BURNHAMTHORPE RD AT THE EAST MALL (PX 948),Major Arterial,Traffic Signal,8,23677.25,0.015,11,0.5610246178435081
DELAWARE AVE N AT GEARY AVE,Major Arterial,No Control,3,1630.0,0.015,11,3.0560245704375464
DEARHAM WOOD AT GALLOWAY RD,Collector,Stop Sign,2,1729.0,0.015,11,1.9206940620062467
KIPLING AVE AT NORSEMAN ST (PX 725),Major Arterial,Traffic Signal,2,20242.0,0.015,11,0.16405888910230218
DUFFERIN ST AT MILLICENT ST,Major Arterial,No Control,2,10002.0,0.015,11,0.33202159900107986
BLOOR ST E AT CHURCH ST,Major Arterial,Traffic Signal,5,16976.8,0.015,11,0.4890320957437209
FINCH AVE AT ROMFIELD LANE (PX 1061),Local,Stop Sign,3,9679.0,0.015,11,0.5146523452643041
INNISWOOD DR AT PHARMACY AVE (PX 1411),Minor Arterial,No Control,2,12023.0,0.015,11,0.2762105991190884
BARRYMORE D AT DANFORTH RD (PX 2310),Major Arterial,No Control,6,13141.0,0.015,11,0.7581340917454077
KENNEDY RD AT NORCAP AVE (PX 1684),Major Arterial,No Control,2,18509.0,0.015,11,0.17941974354145554
KINGSTON RD AT PORT UNION RD & SHEPPARD AVE E,Major Arterial,Traffic Signal,5,24636.8,0.015,11,0.33698370255154897
DANFORTH AVE AT MONARCH PARK AVE (PX 944),Major Arterial,No Control,2,12113.0,0.015,11,0.274158345018476
JANE ST AT TROUTBROOKE DR (PX 2284),Major Arterial,Traffic Signal,3,14619.0,0.015,11,0.34074287227670846
FRONT ST W AT UNIVERSITY AVE & YORK ST (PX 75),Minor Arterial,Stop Sign,2,19235.0,0.015,11,0.17264777921543023
BATHURST ST AT FINCH AVE W (PX 675),Major Arterial,Traffic Signal,5,35911.0,0.015,11,0.2311882176219543
ALBION RD AT MARTIN GROVE RD (PX 791),Major Arterial,No Control,6,24269.0,0.015,11,0.41050888374578276
ISLINGTON AVE AT MONOGRAM PL (PX 1609),Major Arterial,Traffic Signal,3,20404.0,0.015,11,0.24413448587596553
DUNDAS ST W AT DUPONT ST,Minor Arterial,No Control,1,11571.0,0.015,11,0.1435001310694322
BATHURST ST AT COCKSFIELD AVE,Major Arterial,No Control,3,16347.0,0.015,11,0.3047238055798129
AVENUE RD AT CHAPLIN CRES (PX 116),Major Arterial,Traffic Signal,5,15375.8,0.015,11,0.5399523981205532
COLBORNE LODGE DR AT THE QUEENSWAY (PX 560),Major Arterial,No Control,2,14599.0,0.015,11,0.2274731168716214
BAYVIEW AVE AT POTTERY RD (PX 1379),None,No Control,5,21380.0,0.015,11,0.3883161872320861
BATHURST ST AT EGLINTON AVE (PX 100),Major Arterial,Traffic Signal,6,20569.0,0.015,11,0.4843521853092713
BLACK CREEK DR S TCS AT JANE ST (PX 235),Major Arterial,Traffic Signal,2,23713.0,0.015,11,0.14004470261918783
ADELAIDE ST AT JOHN ST (PX 1090),Major Arterial,Traffic Signal,2,14085.0,0.015,11,0.23577423025976574
DAWES RD AT SECORD AVE,Minor Arterial,Traffic Signal,2,6438.0,0.015,11,0.515824795465797
GRENADIER RD AT RONCESVALLES AVE,Minor Arterial,No Control,2,5467.0,0.015,11,0.607441015768941
SHEPPARD AVE E AT VANDORF ST,Minor Arterial,No Control,2,6204.0,0.015,11,0.5352804695694391
STEELES AVE E AT WAGGONERS WELLS LANE,Major Arterial,No Control,6,18595.666666666668,0.015,11,0.5357506282624841
JANE ST AT SHERIDAN MALL (PX 1472),Major Arterial,No Control,2,17573.0,0.015,11,0.18897627230460368
GENTHORN AVE AT KIPLING AVE (PX 1797),Major Arterial,Traffic Signal,5,8901.0,0.015,11,0.9327266692531178
BAYVIEW AVE AT BROADWAY AVE (PX 179),Major Arterial,Traffic Signal,3,18664.0,0.015,11,0.26689455903414067
GEARY AVE AT OSSINGTON AVE,Minor Arterial,No Control,4,6735.0,0.015,11,0.9861559118660135
MARKHAM RD AT NASHDENE RD (PX 1620),Major Arterial,Traffic Signal,7,22035.0,0.015,11,0.5274826465273792
PALMDALE DR AT SHEPPARD AVE E,Major Arterial,No Control,2,15438.0,0.015,11,0.2151107677943257
KIPLING AVE AT THE QUEENSWAY (PX 568),Major Arterial,No Control,3,33014.0,0.015,11,0.1508850805662204
BROWNS LINE AT LAKE SHORE BLVD (PX 242),Major Arterial,No Control,2,13121.5,0.015,11,0.25308692094720886
OAKWOOD AVE AT VAUGHAN RD (PX 803),Minor Arterial,Traffic Signal,6,12032.0,0.015,11,0.8280119763652262
OLD FINCH AVE AT RESSOR RD,Collector,No Control,1,3080.0,0.015,11,0.5391039014949351
DANFORTH AVE AT PHARMACY AVE (PX 356),Major Arterial,Traffic Signal,5,15173.2,0.015,11,0.5471621070718108
BREMNER BLVD AT SPADINA AVE & FORT YORK BLVD,Minor Arterial,No Control,10,19625.0,0.015,11,0.8460840848939619
ROYAL YORK RD AT THE QUEENSWAY,Major Arterial,Traffic Signal,9,21425.444444444445,0.015,11,0.697486588350074
BATHURST ST AT RANEE AVE (PX 316),Major Arterial,No Control,2,12645.0,0.015,11,0.2626239646665718
BAMBURGH CIR S AT WARDEN AVE (PX 722),Collector,No Control,9,12797.888888888889,0.015,11,1.1676894743486899
OSSINGTON AVE AT PENDRITH ST,Minor Arterial,No Control,2,6748.0,0.015,11,0.4921280428584471
BROWNS LINE AT WOODBURY RD (PX 2477),Major Arterial,Pedestrian Crossover,3,12410.0,0.015,11,0.4013956526843836
BOTHAM RD AT STUART AVE & STUART CRES,Collector,Stop Sign,2,542.0,0.015,11,6.127084932119558
COLLEGE ST AT OSSINGTON AVE (PX 829),Minor Arterial,No Control,6,13339.666666666666,0.015,11,0.7468432569249409
HIGHWAY 27 AT HUMBER COLLEGE BLVD (PX 1162),Major Arterial,No Control,8,24724.125,0.015,11,0.5372695750743535
CHEROKEE BLVD AT FINCH AVE E,Major Arterial,No Control,8,18691.0,0.015,11,0.71069071386417
BESTVIEW DR AT STEELES AVE E,Major Arterial,No Control,7,21884.0,0.015,11,0.5311222864298484
ISLINGTON AVE AT AVIEMORE DR (PX 2586),Local,No Control,4,13147.0,0.015,11,0.5051920640767933
BAMBURGH CIR N AT WARDEN AVE (PX 1490),Major Arterial,Traffic Signal,4,14977.0,0.015,11,0.4434639825343928
CARNFORTH RD AT LAWRENCE AVE E,Major Arterial,Traffic Signal,5,25522.0,0.015,11,0.3252958264643054
COLBECK ST AT JANE ST,Major Arterial,Pedestrian Crossover,2,9166.0,0.015,11,0.36230417119886543
DANFORTH RD AT KENNEDY RD (PX 375),Minor Arterial,No Control,4,9927.0,0.015,11,0.6690601457054096
PORTLAND ST AT RICHMOND ST W (PX 1097),Major Arterial,No Control,2,6506.0,0.015,11,0.5104334511541347
ALBANY AVE AT BLOOR ST W AND LIPPINCOTT ST,Major Arterial,Stop Sign,4,9530.0,0.015,11,0.6969318013030011
BONESET RD AT SHEPPARD AVE E,Major Arterial,No Control,2,16280.0,0.015,11,0.20398526002511058
CAPRI RD AT THE EAST MALL (PX 2523),Minor Arterial,No Control,3,4941.0,0.015,11,1.0081603015205831
ISABELLA ST AT SHERBOURNE ST (PX 1391),Collector,No Control,3,10123.0,0.015,11,0.4920794280167145
REXDALE BLVD AT 71 REXDALE BLVD,Major Arterial,No Control,2,10599.0,0.015,11,0.31332012767325224
QUEEN ST W AT PALMERSTON AVE & TECUMSETH ST,Major Arterial,Traffic Signal,2,12519.0,0.015,11,0.2652671965179967
ELLESMERE RD AT WARDEN AVE,Major Arterial,Traffic Signal,7,38567.0,0.015,11,0.3013737162919284
GATEFORTH DR AT SHEPPARD AVE E,Major Arterial,Traffic Signal,6,10406.0,0.015,11,0.9573938208366712
OLD WESTON RD AT ROCKWELL AVE (PX 2562),Collector,No Control,3,7321.0,0.015,11,0.6804152506233029
CUMMER AVE AT WILLOWDALE AVE (PX 806),Minor Arterial,Traffic Signal,4,14020.0,0.015,11,0.4737346695019687
MIDLAND AVE AT SHEPPARD AVE E,Major Arterial,Traffic Signal,8,26092.5,0.015,11,0.5090934227396838
THE WEST MALL AT WESTSIDE DR,Minor Arterial,No Control,3,8111.0,0.015,11,0.6141437615353471
ROYAL YORK RD AT HUMBERTOWN PLAZA,Minor Arterial,No Control,9,13455.666666666666,0.015,11,1.1106071902375407
KEELE ST AT STEELES AVE W,Major Arterial,Traffic Signal,17,38540.94117647059,0.015,11,0.7324024639934793
HIGHWAY 401 N TCS AT VICTORIA PARK AVE (PX 758),Major Arterial,No Control,2,27582.0,0.015,11,0.12040026224381122
KENDAL AVE AT SPADINA RD,Minor Arterial,No Control,3,7901.0,0.015,11,0.6304670357946084
BIRCHMOUNT RD AT DANFORTH AVE (PX 359),Minor Arterial,No Control,6,9977.333333333334,0.015,11,0.9985273385967928
FOLKES ST AT JANE ST,Major Arterial,No Control,3,7145.0,0.015,11,0.6971756542775648
FINCH AVE AT PICKERING TOWN LINE,Local,Stop Sign,2,1307.0,0.015,11,2.5408416474436115
COMMONS DR AT SHEPPARD AVE E,Major Arterial,No Control,2,16537.0,0.015,11,0.20081514381138058
BAY ST AT 12M N OF HAGERMAN (PX 1478),Major Arterial,Traffic Signal,3,9742.0,0.015,11,0.511324168529378
SHEPPARD AVE E AT AMBROSE RD & PROVOST DR (PX 1014),Major Arterial,Traffic Signal,8,24702.25,0.015,11,0.5377453524612211
CODSELL AVE AT WILSON HEIGHTS BLVD,Collector,Stop Sign,2,7871.0,0.015,11,0.4219133570332614
COMBE AVE AT WILMINGTON AVE,Minor Arterial,Stop Sign,2,4959.0,0.015,11,0.6696672783240171
INDIAN VALLEY CRES AT PARKSIDE DR (PX 1805),Major Arterial,Traffic Signal,7,15040.0,0.015,11,0.7728111779408777
LAKE SHORE BLVD AT THIRTIETH ST (PX 239),Major Arterial,No Control,6,11264.0,0.015,11,0.884467338390128
HUMBERVIEW RD AT JANE ST,Major Arterial,No Control,4,9814.0,0.015,11,0.6767638135742409
JANE ST AT SHOREHAM DR (PX 967),Major Arterial,No Control,8,14864.5,0.015,11,0.8936405619317974
DUNDAS ST W AT SHAVER AVE & SHORNCLIFFE RD (PX 778),Major Arterial,Traffic Controller,2,22555.0,0.015,11,0.147234760949182
GUILDCREST DR AT KINGSTON RD & SAUNDERS RD,Major Arterial,No Control,4,24324.0,0.015,11,0.27305377678085846
CARTWRIGHT AVE AT DUFFERIN ST,Major Arterial,No Control,3,24327.0,0.015,11,0.20476507788930823
LESLIE ST AT TANGLE BRIARWAY & VAN HORNE AVE (PX 1012),Major Arterial,Traffic Signal,2,13526.0,0.015,11,0.2455182635819016
FRASER AVE AT KING ST W,Major Arterial,Streetcar (Stop for),2,7044.0,0.015,11,0.47144804560034076
JANE ST AT WRIGHT AVE (PX 2290),Major Arterial,No Control,3,16646.0,0.015,11,0.2992502733277184
MCCOWAN RD AT MCNICOLL AVE,Major Arterial,Traffic Signal,7,22232.0,0.015,11,0.5228085694598238
CANNING AVE AT PAPE AVE,Major Arterial,No Control,2,7828.0,0.015,11,0.4242309700062341
ELLESMERE RD AT MORNINGSIDE AVE,Major Arterial,No Control,3,17066.0,0.015,11,0.2918856234509083
PARKSIDE DR AT SPRING RD (PX 1806),Major Arterial,Traffic Signal,10,13579.6,0.015,11,1.2227458957586381
DON MILLS RD AT GEORGE HENRY BLVD,Major Arterial,Traffic Signal,2,19142.0,0.015,11,0.17348657576056842
HICKORY TREE RD AT LAWRENCE AVE & LITTLE AVE (PX 500),Major Arterial,Traffic Signal,5,13630.0,0.015,11,0.6091122584755687
CARLTON ST AT JARVIS ST,Major Arterial,Traffic Signal,7,16638.285714285714,0.015,11,0.6985743793455336
CROATIA ST AT DUFFERIN ST,Major Arterial,Stop Sign,5,10814.0,0.015,11,0.7677270282062143
ALBION RD AT SILVERSTONE DR (PX 1156),Major Arterial,No Control,3,15275.333333333334,0.015,11,0.3261022159786934
HANNA RD AT MILLWOOD RD,Collector,No Control,2,5063.0,0.015,11,0.6559115214712227
HARBORD ST AT OSSINGTON AVE (PX 836),Minor Arterial,No Control,2,10397.0,0.015,11,0.31940752459447924
QUEENS PARK CR E AT WELLESLEY ST W (PX 84),Major Arterial,Traffic Signal,2,17026.0,0.015,11,0.19504757624860805
YONGE BLVD AT YONGE ST (PX 58),Major Arterial,Traffic Controller,2,24649.0,0.015,11,0.1347267651105035
MAXWELL ST AT WATERLOO AVE,Local,Stop Sign,2,714.0,0.015,11,4.651092483485716
GERRARD ST E AT HANNAFORD ST & WILLIAM HANCOX AVE,Minor Arterial,No Control,2,11092.0,0.015,11,0.2993941609456185
COSBURN AVE AT DONLANDS AVE (PX 668),Minor Arterial,No Control,2,12468.0,0.015,11,0.2663522644537055
BIRCHMOUNT RD AT SANWOOD BLVD & WINTERMUTE BLVD (PX 1504),Major Arterial,No Control,2,11423.0,0.015,11,0.2907187282858094
BLOOR ST AT BRUNSWICK AVE (PX 509),Major Arterial,Traffic Signal,2,9016.0,0.015,11,0.3683318581642414
BRITISH COLUMBIA RD AT LAKE SHORE BLVD (PX 1344),Major Arterial,Traffic Signal,4,30950.0,0.015,11,0.21459644802641684
BROADVIEW AVE AT FULTON AVE,Minor Arterial,No Control,2,9883.0,0.015,11,0.3360194306595974
EAST DR AT SCARLETT RD (PX 782),Minor Arterial,Traffic Signal,2,10746.0,0.015,11,0.30903406227515356
ROCKCLIFFE BLVD AT ROCKCLIFFE CRT,Collector,No Control,7,4732.0,0.015,11,2.4562722139118343
PATRICIA AVE AT YONGE ST (PX 856),Major Arterial,No Control,6,22077.0,0.015,11,0.4512678398163882
BURNHAMTHORPE RD AT OLD BURNHAMTHORPE RD & SATURN RD (PX 975),Major Arterial,Traffic Signal,2,18981.0,0.015,11,0.1749581177603288
BIRCHMOUNT RD AT ZENITH DR,Minor Arterial,No Control,6,7052.0,0.015,11,1.4127396624541126
CALEDONIA RD AT ROGERS RD (PX 800),Minor Arterial,No Control,7,17246.0,0.015,11,0.6739580259904211
DAVENPORT RD AT DOVERCOURT RD (PX 2497),Minor Arterial,No Control,2,12465.0,0.015,11,0.2664163684884717
BRIMLEY RD AT CHILLERY AVE (PX 1704),Major Arterial,Stop Sign,2,10557.0,0.015,11,0.31456664139516916
SEWELLS RD AT STEELES AVE E,Minor Arterial,Stop Sign,17,8193.0,0.015,11,3.445316768250312
ANCASTER RD AT WILSON AVE (PX 1667),Local,No Control,3,14652.0,0.015,11,0.3399754333751843
CHURCH ST AT PARK RD (PX 165),Major Arterial,Traffic Signal,2,11309.0,0.015,11,0.29364930879908047
DRIFTWOOD AVE AT YORKWOODS GATE,Collector,Stop Sign,3,3584.0,0.015,11,1.3898772460416298
JACKMAN AVE AT MORTIMER AVE,Minor Arterial,No Control,2,6414.0,0.015,11,0.5177549163094481
JARVIS ST AT RICHMOND ST E,Major Arterial,Traffic Signal,7,19393.571428571428,0.015,11,0.5993264396421171
KIPLING AVE AT NEW TORONTO ST (PX 1322),Major Arterial,No Control,2,10860.0,0.015,11,0.30579005830651934
DUFFERIN ST AT DUPONT ST (PX 608),Major Arterial,Traffic Signal,19,20377.21052631579,0.015,11,1.5482178129700839
MAGELLAN DR AT SHEPPARD AVE (PX 2262),Major Arterial,Traffic Signal,3,12811.0,0.015,11,0.3888314768412459
BLOOR ST W AT KENNEDY PARK RD,Major Arterial,No Control,5,11874.0,0.015,11,0.699191517855988
YONGE ST AT MOUNT PLEASANT CEMETERY ENTRANCE,Major Arterial,No Control,1,14058.0,0.015,11,0.11811353084396074
COLLEGE ST AT SPADINA AVE (PX 279),Major Arterial,No Control,6,15016.666666666666,0.015,11,0.6634388523613587
CENTENNIAL RD AT LAWRENCE AVE (PX 1452),Minor Arterial,Traffic Signal,4,7621.0,0.015,11,0.8715076848730614
BRIMWOOD BLVD AT DELBURN DR,Collector,Stop Sign,2,2658.0,0.015,11,1.2493905316812643
BRIDGELAND AVE AT CALEDONIA RD,Minor Arterial,No Control,2,7658.0,0.015,11,0.43364847652243416
HIGHWAY 401 S TCS AT VICTORIA PARK AVE (PX 759),Major Arterial,Traffic Signal,2,32120.0,0.015,11,0.10338978932779577
MARKHAM RD AT MCLEVIN AVE & NUGGET AVE (PX 1239),Major Arterial,Traffic Signal,3,30012.666666666668,0.015,11,0.16597392378151005
BRUNELLO GATE AT MARTIN GROVE RD,Minor Arterial,Stop Sign,2,6852.0,0.015,11,0.48465849871698785
AVENUE RD AT ROXBOROUGH ST W,Major Arterial,No Control,4,19391.0,0.015,11,0.34251766625844987
MARTIN GROVE RD AT MERCURY RD / WESTHUMBER BLVD (PX 902),Major Arterial,Traffic Signal,3,10642.0,0.015,11,0.46808119242747614
QUEENS QUAY W AT 95M EAST OF LOWER SIMCOE ST (PX 2343),Minor Arterial,No Control,8,10791.0,0.015,11,1.2309813856765084
MELITA CRES AT WYCHCREST AVE (WEST INTERSECTION),Collector,Stop Sign,1,957.0,0.015,11,1.7350470392940442
CENTRAL PARK RDWY AT CORDOVA AVE & ISLINGTON AVE (PX 1771),Major Arterial,No Control,7,17877.0,0.015,11,0.6501694980271188
MIDDLEFIELD RD AT PEBBLEWOOD AVE,Minor Arterial,No Control,2,10844.0,0.015,11,0.30624124245746964
EGLINTON AVE E WEST OF MIDLAND AVE,Major Arterial,No Control,4,10362.0,0.015,11,0.6409727915863348
DANFORTH AVE AT WOODYCREST AVE (PX 2478),Major Arterial,No Control,4,12191.0,0.015,11,0.5448084707093431
DENSLEY AVE AT FLAMBOROUGH DR & KEELE ST (PX 593),Major Arterial,Traffic Signal,2,14352.0,0.015,11,0.23138796218010038
HIGHWAY 401 N TCS AT KEELE ST (PX 596),Major Arterial,Traffic Signal,2,32542.0,0.015,11,0.10204904533245654
ISLINGTON AVE AT SUMMITCREST DR (PX 710),Major Arterial,Traffic Signal,2,16058.0,0.015,11,0.20680533274435173
BRIMLEY RD AT FRASERTON CR & SHEDIAC RD (PX 2065),Major Arterial,No Control,3,12376.0,0.015,11,0.40249838799395615
RUSSELL ST AT ST GEORGE ST,Minor Arterial,Pedestrian Crossover,3,7193.0,0.015,11,0.6925232934538025
CONLINS RD AT ELLESMERE RD,Minor Arterial,Traffic Signal,2,8085.0,0.015,11,0.4107458297104268
ABITIBI AVE AT WILLOWDALE AVE (PX 2164),Minor Arterial,Traffic Signal,2,8082.0,0.015,11,0.410898296610839
RATHBURN RD AT THE WEST MALL (PX 937),Minor Arterial,No Control,8,13828.0,0.015,11,0.9606248288136535
BLOOR ST E AT CASTLE FRANK RD,Major Arterial,No Control,2,28273.0,0.015,11,0.11745764627767838
BRANDON AVE AT DUFFERIN ST (PX 1272),Major Arterial,No Control,2,12708.0,0.015,11,0.26132200450179416
BIRCHMOUNT RD AT CHALDEAN ST AND GLENDOWER CRCT,Major Arterial,Stop Sign,2,13073.0,0.015,11,0.2540258573555267
DUPLEX AVE AT MONTGOMERY AVE (PX 2516),Minor Arterial,Stop Sign,2,8483.0,0.015,11,0.3914747180488979
DOLOMITE DR AT DUFFERIN ST (PX 1196),Major Arterial,Traffic Signal,1,21996.0,0.015,11,0.0754882713495363
GRAND MARSHALL DR AT SHEPPARD AVE E & WATER TOWER GATE,Major Arterial,Traffic Signal,2,16800.0,0.015,11,0.19767143054814287
KINGSTON RD AT RIDGEMOOR AVE & SHARPE ST,Major Arterial,Traffic Signal,6,16759.0,0.015,11,0.5944650694925951
PASSMORE AV AT SILVER STAR BLVD (PX 2049),Collector,Traffic Signal,2,8116.0,0.015,11,0.40917693854223763
BLOOR ST W AT LEAVENWORTH CRES AND RENFORTH DR,Major Arterial,No Control,2,13797.0,0.015,11,0.24069580584248754
DANFORTH RD AT FALMOUTH AVE & GLENSHEPHARD DR,Major Arterial,No Control,2,11154.0,0.015,11,0.2977299653226467
HIGHWAY 401 N TCS AT LESLIE ST (PX 753),Major Arterial,Traffic Signal,2,36462.0,0.015,11,0.09107783536857005
COLLEGE ST AT MCCAUL ST (PX 825),Major Arterial,No Control,5,11882.0,0.015,11,0.698720761069012
BLOOR ST W AT MARGUERETTA ST W,Local,No Control,2,10034.0,0.015,11,0.33096273003874827
PASSMORE AVE AT TAPSCOTT RD,Minor Arterial,Stop Sign,2,7550.0,0.015,11,0.4398516600276557
KIPLING AVE AT NAMCO RD,Major Arterial,Stop Sign,5,14325.0,0.015,11,0.5795602152196859
MARTIN GROVE RD AT RACINE RD (PX 1212),Major Arterial,No Control,1,11435.0,0.015,11,0.145206822615164
BLACK CREEK DR AT PHOTOGRAPHY DR (PX 1438),Major Arterial,Traffic Signal,2,14575.0,0.015,11,0.2278476866695575
EGLINTON AVE E AT BERMONDSEY RD & SLOANE AVE,Major Arterial,Traffic Signal,6,18015.0,0.015,11,0.5530191562379351
JANE ST AT 35M N OF MACDONALD AVE & MARSHLYNN AVE (PX 1675),Major Arterial,Stop Sign,3,17024.0,0.015,11,0.29260573600876416
CENTENNIAL PARK BV AT EGLINTON AVE & ORBITOR DR (PX 1484),Major Arterial,Traffic Signal,4,18774.0,0.015,11,0.3537743723456696
DUNDAS ST W AT ELIZABETH ST,Major Arterial,No Control,2,10685.0,0.015,11,0.31079831850339734
HOLIDAY DR AT THE WEST MALL (PX 2215),Minor Arterial,No Control,6,5958.0,0.015,11,1.6721450318271907
FAYWOOD BLVD AT WILSON AVE,Major Arterial,Stop Sign,8,12715.0,0.015,11,1.0447125546862133
EGLINTON AVE W AT KEELE ST & TRETHEWEY DR,Major Arterial,No Control,2,21709.0,0.015,11,0.15297250141456542
MIDLAND AVE AT 35M S OF NORBURY CRES (PX 2103),Major Arterial,Stop Sign,10,12007.0,0.015,11,1.3828933260634633
ARCADE DR AT CHAPMAN RD,Local,No Control,3,646.0,0.015,11,7.711021748936843
CORINTHIAN BLVD N AT PHARMACY AVE & PINEMEADOW BLVD (PX 1465),Major Arterial,No Control,2,7990.0,0.015,11,0.4156295410774469
BURNHAMTHORPE RD AT CORDOVA AVE & DUNDAS ST (PX 777),Major Arterial,No Control,10,20472.0,0.015,11,0.8110785544179369
EGLINTON AVE E AT HANNA RD,Major Arterial,No Control,3,7997.0,0.015,11,0.6228985931990998
BIG RED AVE AT WHITE HEATHER BLVD,Collector,No Control,2,1202.0,0.015,11,2.7627953687261235
AVENUE RD AT ST CLAIR AVE W (PX 112),Major Arterial,Traffic Signal,10,25623.0,0.015,11,0.648027169575928
O CONNOR DR AT WAKUNDA PL,Major Arterial,No Control,2,8943.0,0.015,11,0.3713384807345187
SCARSDALE RD AT YORK MILLS RD,Major Arterial,Traffic Signal,7,18490.0,0.015,11,0.6286143924408222
NORTH QUEEN ST AT NOVA RD (PX 1927),Minor Arterial,Stop Sign,7,12897.0,0.015,11,0.9012235493704583
BATHURST ST AT NASSAU ST (PX 2253),Major Arterial,Traffic Signal,6,10717.0,0.015,11,0.9296109078684708
HIGHWAY 27 AT QUEENS PLATE DR (PX 1246),Major Arterial,Traffic Signal,2,23955.0,0.015,11,0.13862993250715092
BATHURST ST AT WARWICK AVE (PX 506),Major Arterial,No Control,4,15222.0,0.015,11,0.436326374091289
MARKHAM RD AT PAINTED POST DR (PX 877),Major Arterial,Traffic Signal,2,15512.0,0.015,11,0.21408458182109338
CLEMENT RD AT HUNTING RIDGE & KIPLING AVE (PX 1036),Major Arterial,Traffic Signal,2,12252.0,0.015,11,0.2710479948750245
MARTIN GROVE RD AT RONSON DR,Major Arterial,No Control,2,13016.0,0.015,11,0.25513829388512604
CHATSWORTH DR AT LAWRENCE AVE (PX 501),Major Arterial,No Control,2,14052.0,0.015,11,0.23632792721383436
BURNHAMTHORPE RD AT MARTIN GROVE RD (PX 785),Major Arterial,No Control,3,15937.0,0.015,11,0.31256322079520615
HINTON RD AT KIPLING AVE (PX 2137),Local,No Control,4,10608.0,0.015,11,0.6261086035461539
ELLESMERE RD AT MONDEO DR,Major Arterial,Traffic Signal,2,22114.0,0.015,11,0.15017093394269695
BENTWORTH AVE AT DUFFERIN ST & RANEE AVE (PX 615),Major Arterial,Traffic Signal,4,24408.0,0.015,11,0.27211406368475916
FINCH AVE AT #2405 FINCH AVE,Major Arterial,No Control,2,19034.0,0.015,11,0.17447094847161923
DUFFERIN ST AT WILSON AVE (PX 617),Major Arterial,Traffic Signal,2,19455.0,0.015,11,0.17069545274781805
ADELAIDE ST AT CHURCH ST (PX 17),Major Arterial,Traffic Signal,3,14808.0,0.015,11,0.33639384453087523
CONCORDE GT AT CONCORDE PL,Collector,No Control,2,4696.0,0.015,11,0.7071720684005112
VEROBEACH BLVD AT WESTON RD,Major Arterial,No Control,1,13227.0,0.015,11,0.12553413597976867
CURLEW DR AT LYNVALLEY CRES & VICTORIA PARK AVE (PX 516),Major Arterial,Traffic Signal,4,19149.0,0.015,11,0.34684631398076143
GERRARD ST E AT SACKVILLE ST,Minor Arterial,No Control,2,9585.0,0.015,11,0.34646635714228485
ADELAIDE ST W AT PORTLAND ST,Major Arterial,No Control,4,7196.5,0.015,11,0.9229153152807059
CASTLETON AVE AT CORBETT AVE AND ROCKCLIFFE BLVD,Local,No Control,2,5430.0,0.015,11,0.6115801166130387
GERRARD ST AT MAIN ST (PX 363),Minor Arterial,Traffic Signal,4,11234.0,0.015,11,0.5912195181073172
CRAIGMONT DR AT CUMMER AVE,Collector,No Control,2,6050.0,0.015,11,0.5489057906130248
DON MILLS RD AT MCNICOLL AVE,Major Arterial,Traffic Signal,5,11771.0,0.015,11,0.705309666385354
MILLWOOD RD AT OVERLEA BLVD,Major Arterial,Traffic Signal,2,22039.0,0.015,11,0.15068197437310224
NINTH LINE AT STEELES AVE E,Minor Arterial,No Control,2,12637.0,0.015,11,0.2627902218254966
KINGSTON RD AT SCARBOROUGH GOLF CLUB RD (PX 1053),Major Arterial,Traffic Signal,11,22976.0,0.015,11,0.7949530023784994
OLD FINCH AVE AT MORNINGVIEW TRL & VALLEY CENTRE DR,Local,No Control,2,2364.0,0.015,11,1.4047715876517768
BAYVIEW AVE AT HEATHCOTE AVE,Major Arterial,No Control,2,22939.0,0.015,11,0.14477004373376348
BAY ST AT KING ST W,Major Arterial,Traffic Signal,2,16503.0,0.015,11,0.20122886949092894
BLOOR ST W AT KENNEDY AVE,Major Arterial,No Control,2,11743.0,0.015,11,0.28279656248052465
EGLINTON AVE E AT TORRANCE RD (PX 1825),Major Arterial,Traffic Signal,1,15004.0,0.015,11,0.11066649004294857
DUFFERIN ST AT KING ST W (PX 539),Major Arterial,Traffic Signal,2,14511.0,0.015,11,0.22885259687194548
COLLINSGROVE RD AT 140M NORTH OF LAWRENCE AVE (#25 COLLINSGROVE),Collector,No Control,2,1458.0,0.015,11,2.277695496027984
MARTIN GROVE RD AT SILVERSTONE DR (PX 1519),Minor Arterial,No Control,2,10314.0,0.015,11,0.32197789734426996
W R ALLEN RD AT HIGHWAY 401 OFF RAMP / YORKDALE RD (PX 1451),Minor Arterial,Traffic Signal,1,17907.0,0.015,11,0.09272575063407608
CARLAW AVE AT DUNDAS ST E,Minor Arterial,Traffic Signal,3,12799.0,0.015,11,0.3891960348318776
KINGSTON RD AT OLD KINGSTON RD,Major Arterial,Traffic Signal,1,17761.0,0.015,11,0.09348798021532574
GOLDCREST BLVD AT LAWRENCE AVE W,Major Arterial,No Control,5,18008.6,0.015,11,0.4610130761426209
LAVINGTON DR AT MARTIN GROVE RD (PX 2197),Major Arterial,No Control,10,10068.0,0.015,11,1.6492252846686535
BLOOR ST W AT GRENVIEW BLVD N & GRENVIEW BLVD S,Major Arterial,Stop Sign,2,15837.0,0.015,11,0.2096912314964198
BATHURST ST AT LENNOX ST (PX 1683),Major Arterial,Traffic Signal,7,16713.0,0.015,11,0.6954514519374619
AVONDALE AVE AT FLORENCE AVE & YONGE ST (PX 481),Major Arterial,No Control,6,39886.0,0.015,11,0.24977786941850275
MARKHAM RD AT ROSEBANK DR,Major Arterial,No Control,3,22773.0,0.015,11,0.21873798137325787
BROADWAY AVE AT MOUNT PLEASANT RD (PX 139),Major Arterial,Traffic Signal,3,16040.0,0.015,11,0.3105561128312469
BAY ST AT YORKVILLE AVE (PX 895),Collector,No Control,3,12553.0,0.015,11,0.3968230741506572
