count_location,ROAD_CLASS,TRAFFCTL,num_of_collisions,total_traffic,average_int_width,years,r
STEELES AVE E AT ESNA PARK DR & PHARMACY AVE,Major Arterial,Traffic Signal,10,29831.0,0.015,11,0.5566156067863632
BRIMLEY RD AT HWY 401 NORTH SIDE,Major Arterial,No Control,5,17015.0,0.015,11,0.48793418060664123
ST CLAIR AVE AT VICTORIA PARK AVE (PX 471),Major Arterial,No Control,4,25465.0,0.015,11,0.26081916616601614
CRESCENT TOWN RD AT DAWES RD,Minor Arterial,Traffic Signal,1,6612.0,0.015,11,0.2511252293715064
HERRON AVE AT ST CLAIR AVE (PX 641),Major Arterial,Traffic Signal,4,16013.0,0.015,11,0.41477300108771625
GARDENTREE ST AT MORNINGSIDE AVE AND PIXLEY CRES,Minor Arterial,No Control,2,4014.0,0.015,11,0.8273243729967117
LAKE SHORE BLVD AT LOWER JARVIS ST (PX 210),Major Arterial,Traffic Signal,33,25914.0,0.015,11,2.114475594194073
BALDWIN ST AT SPADINA AVE,Major Arterial,No Control,11,4493.0,0.015,11,4.0651769825614075
KEELE ST AT WHITBURN CRES (PX 1255),Major Arterial,Traffic Signal,6,17792.333333333332,0.015,11,0.5599400546842124
MARKET ST AT THE ESPLANADE,Local,No Control,2,4391.0,0.015,11,0.756292423869005
ELLERSLIE AVE AT NORTON AVE & YONGE ST,Major Arterial,No Control,8,15604.75,0.015,11,0.8512485065659625
DUNDAS ST E AT REGENT ST,Major Arterial,No Control,2,6531.0,0.015,11,0.5084795641109785
DUNDAS ST W AT KENSINGTON AVE,Major Arterial,No Control,2,7964.0,0.015,11,0.4169864431452537
DENTON AVE AT ROBINSON AVE,Collector,Stop Sign,2,1126.0,0.015,11,2.9492717879296633
MCRAE DR AT MILLWOOD RD (PX 683),Collector,Traffic Signal,2,7982.0,0.015,11,0.41604610789386126
OTONABEE AVE AT WILLOWDALE AVE (PX 2199),Local,No Control,2,8480.0,0.015,11,0.3916132114633019
GERRARD ST E AT PEMBROKE ST,Minor Arterial,No Control,3,8292.0,0.015,11,0.6007380667888569
DUNDAS ST W AT GLADSTONE AVE,Minor Arterial,No Control,4,9983.0,0.015,11,0.6653070285903637
LANGBOURNE PL AT THE DONWAY W/CONDO DRIVEWAY,Minor Arterial,No Control,3,6553.0,0.015,11,0.7601587135377997
DUNDAS ST AT PACIFIC AVE (PX 187),Major Arterial,No Control,6,9831.0,0.015,11,1.0133903061363443
CLAREMONT ST AT DUNDAS ST W,Major Arterial,No Control,2,7735.0,0.015,11,0.42933161386021984
BROOKMERE RD AT KIPLING AVE & WESTHUMBER BLVD (PX 733),Major Arterial,Traffic Signal,22,9951.0,0.015,11,3.6709557195555025
DOVERCOURT RD AT DUPONT ST (PX 843),Major Arterial,Traffic Signal,4,16656.0,0.015,11,0.3987608109040347
EGLINTON AVE E AT HUNTINGTON AVE,Major Arterial,No Control,4,18768.0,0.015,11,0.35388747156956524
LAKE SHORE BLVD AT MIMICO AVE (PX 232),Major Arterial,No Control,3,7722.0,0.015,11,0.6450815915324011
BELLAMY RD N AT LAWRENCE AVE E (PX 416),Minor Arterial,Stop Sign,7,21947.0,0.015,11,0.5295976724030984
KINGSTON RD AT MIDLAND AVE,Major Arterial,Traffic Signal,4,19688.0,0.015,11,0.33735067383266965
DOVERCOURT RD AT QUEEN ST W,Major Arterial,No Control,6,10043.0,0.015,11,0.9919984167705269
GUILDWOOD PKWY AT ROWATSON RD,Minor Arterial,No Control,2,5092.0,0.015,11,0.6521759688155538
HILDA AVE AT STEELES AVE W,Major Arterial,Traffic Signal,6,27022.0,0.015,11,0.3686862593304124
FINCH AVE AT HUMBERLINE DR (PX 1506),Major Arterial,Traffic Signal,10,18863.0,0.015,11,0.8802629574322218
ELLESMERE RD AT PHARMACY AVE,Major Arterial,Traffic Signal,11,23614.0,0.015,11,0.7734750649042265
MAINSHEP RD AT WESTON RD (PX 2422),Major Arterial,No Control,6,18414.0,0.015,11,0.5410361735433041
DWIGHT AVE AT LAKE SHORE BLVD W,Major Arterial,No Control,8,7588.0,0.015,11,1.7505956948913024
DALESFORD RD AT GRAND AVE,None,No Control,1,2340.0,0.015,11,0.7095897506856411
DON RIVER BLVD AT SHEPPARD AVE W,Major Arterial,No Control,3,14392.0,0.015,11,0.34611729084305176
MERRILL AVE E AT WOODBINE AVE,Major Arterial,Stop Sign,7,8706.0,0.015,11,1.33506548543887
HARBORD ST AT SPADINA AVE (PX 280),Major Arterial,Traffic Signal,5,17579.0,0.015,11,0.4722794290358952
ALBION RD AT KIPLING AVE (PX 734),Major Arterial,No Control,2,22602.0,0.015,11,0.14692859185951687
BENNETT RD AT LAWRENCE AVE (PX 1033),Minor Arterial,Traffic Signal,6,6017.0,0.015,11,1.655748728540203
ESTHER LORRIE DR AT KIPLING AVE,Major Arterial,No Control,4,10432.0,0.015,11,0.6366717855078222
RONCESVALLES AVE AT KING ST W & QUEEN ST W,Major Arterial,No Control,4,9278.5,0.015,11,0.7158226077941048
BLOOR ST W AT SPADINA AVE & SPADINA RD,Major Arterial,Traffic Signal,9,17055.11111111111,0.015,11,0.8762159362130377
SHEPPARD AVE AT W R ALLEN RD (PX 1407),Major Arterial,Traffic Signal,6,37350.0,0.015,11,0.2667373520649639
EPSOM AVE AT WESTLAKE AVE,Local,Stop Sign,2,621.0,0.015,11,5.347632903717875
ELMBROOK CRES AT ERINGATE DR & RENFORTH DR (PX 1349),Minor Arterial,No Control,2,9108.0,0.015,11,0.36461133434440063
ST CLAIR AVE AT WINONA DR (PX 486),Major Arterial,Traffic Signal,4,8215.0,0.015,11,0.8084917914081072
JOHN DRURY DR AT SHEPPARD AVE (PX 1296),Major Arterial,No Control,6,12838.0,0.015,11,0.7760274263613024
DON MILLS RD AT BARBER GREENE RD & GREEN BELT DR,Major Arterial,Traffic Signal,15,17995.0,0.015,11,1.3840844817485969
DUBRAY AVE AT WILSON AVE (PX 857),Major Arterial,No Control,6,15993.0,0.015,11,0.622937541401013
LOWER SHERBOURNE ST AT QUEENS QUAY E AND DOCKSIDE DR (PX 2351),Minor Arterial,No Control,6,6382.0,0.015,11,1.5610529770646195
PARK LAWN RD AT DRIVEWAY TO 88/90 PARK LAWN RD,Major Arterial,No Control,2,15152.0,0.015,11,0.21917106871758188
KINGSGROVE BLVD AT ROYAL YORK RD,Minor Arterial,Stop Sign,5,10211.6,0.015,11,0.813016577521838
BAYVIEW AVE AT HIGHWAY 401 N TCS (PX 647),Major Arterial,Traffic Signal,5,37689.4,0.015,11,0.22027944416790932
PLEASANT BLVD AT YONGE ST,Major Arterial,No Control,3,11709.0,0.015,11,0.4254265991812453
HUNTINGWOOD DR AT KENNEDY RD (PX 1111),Minor Arterial,No Control,3,24091.333333333332,0.015,11,0.20676813445277145
BRENYON WAY AT SEWELLS RD (PX 1788),Minor Arterial,Traffic Signal,3,5462.0,0.015,11,0.9119956151250826
F G GARDINER EXPY ON/OFF RAMPS AT LAKE SHORE BLVD (PX 1944),Major Arterial,No Control,2,11881.0,0.015,11,0.27951182839902367
JAMESON AVE AT KING ST W (PX 540),Minor Arterial,No Control,11,12801.272727272728,0.015,11,1.4267987700735183
DUNDAS ST AT MABELLE AVE (PX 1847),Major Arterial,Traffic Signal,3,11858.0,0.015,11,0.4200809622038456
FAIRFAX CR AT WARDEN AVE (PX 1285),Major Arterial,Traffic Signal,10,14145.1,0.015,11,1.1738623386221378
BAYVIEW AVE AT PARKHURST BLVD & SOUDAN AVE,Major Arterial,Pedestrian Crossover,13,14034.384615384615,0.015,11,1.5380596162509859
ELLESMERE RD AT DUNDALK DR & WYE VALLEY RD,Major Arterial,Traffic Signal,5,20790.4,0.015,11,0.39932854024078424
ALNESS ST AT DOLOMITE DR,Minor Arterial,Stop Sign,4,10448.0,0.015,11,0.6356967904304749
KINGSTON RD AT MORNINGSIDE AVE,Major Arterial,Traffic Signal,10,26726.0,0.015,11,0.6212826523252264
DUNDAS ST E AT LESLIE ST,Minor Arterial,Traffic Signal,5,7645.0,0.015,11,1.085964693658862
BRANDON AVE AT LANSDOWNE AVE,Minor Arterial,No Control,2,8926.0,0.015,11,0.37204571288469646
ARDAGH ST AT JANE ST (PX 1316),Major Arterial,Traffic Signal,2,10338.0,0.015,11,0.3212304152842717
EGLINTON AVE E AT MCCOWAN RD,Major Arterial,No Control,4,14811.0,0.015,11,0.44843427630933774
DEAN PARK RD AT GENERATION BLVD & MEADOWVALE RD (PX 1499),Minor Arterial,Traffic Signal,6,8713.0,0.015,11,1.1434224836022497
DAVENPORT RD AT LAUGHTON AVE (PX 1022),Minor Arterial,Traffic Signal,2,8273.0,0.015,11,0.4014118256024176
HIGHWAY 27 AT REXDALE BLVD (PX 1161),Major Arterial,Traffic Signal,12,25805.583333333332,0.015,11,0.7721305866980779
THE QUEENSWAY AT SHERWAY GARDENS RD (PX 887),Major Arterial,Traffic Signal,4,30070.5,0.015,11,0.22087295077958802
YONGE ST AT 280M S OF CUMMER AVE & # 5791 - 5800 YONGE (PX 2177),Major Arterial,Traffic Signal,5,25244.0,0.015,11,0.3288781525519728
JUDSON ST AT ROYAL YORK RD,Collector,No Control,3,9767.333333333334,0.015,11,0.5099979574581803
CHARLES ST E AT JARVIS ST & MOUNT PLEASANT RD (PX 13),Major Arterial,Traffic Signal,5,15498.0,0.015,11,0.5356949337348045
STEELES AVE W AT CAPSTAN GT & SHALE GT,Major Arterial,Traffic Signal,2,25176.0,0.015,11,0.13190657901210678
DOVERCOURT RD AT DUNDAS ST W,Minor Arterial,No Control,3,8445.0,0.015,11,0.5898543575859325
LOWER SHERBOURNE ST AT THE ESPLANADE (PX 1441),Minor Arterial,Traffic Signal,4,7364.0,0.015,11,0.9019228770257469
ALLANHURST DR AT ROYAL YORK RD (PX 2189),Minor Arterial,Traffic Signal,3,11513.0,0.015,11,0.432669160932268
KING ST W AT UNIVERSITY AVE,Major Arterial,Traffic Signal,4,18793.0,0.015,11,0.35341670124075986
COLUMBINE AVE AT KINGSTON RD,Major Arterial,No Control,1,11365.0,0.015,11,0.146101189318469
CROW TRL AT NEILSON RD (PX 1728),Minor Arterial,Traffic Signal,8,9112.0,0.015,11,1.4578051067641793
HUPFIELD TRL AT MCLEVIN AVE AND PRV ACCESS (PX 2298),Collector,No Control,4,5200.0,0.015,11,1.277261551234154
BRUCEWOOD CRES AT GLENMOUNT AVE & LAWRENCE AVE (PX 1326),Major Arterial,Traffic Signal,6,19906.666666666668,0.015,11,0.5004675200750034
GREENCEDAR CRCT AT GREENCREST CRCT & MARKHAM RD (PX 704),Major Arterial,Traffic Signal,5,14460.0,0.015,11,0.5741493833348549
CHILTON RD AT DONLANDS AVE,None,No Control,7,10146.0,0.015,11,1.1455825070205796
BRIMLEY RD AT DANFORTH RD,Major Arterial,Traffic Signal,2,14392.0,0.015,11,0.2307448605620345
GLEBEMOUNT AVE AT MORTIMER AVE (PX 2409),Minor Arterial,Stop Sign,6,5853.0,0.015,11,1.7021425080516661
ROXBOROUGH ST AT WRENTHAM PL,Collector,Stop Sign,2,3564.0,0.015,11,0.9317845211023571
JANE ST AT STEELES AVE W (PX 535),Major Arterial,Traffic Signal,7,30701.0,0.015,11,0.3785896262737631
HEATHER RD AT GLEN WATFORD DR,Collector,Stop Sign,2,1769.0,0.015,11,1.8772640097279822
LAKE SHORE BLVD AT MARINE PARADE DR & PARK LAWN RD (PX 230),Major Arterial,Traffic Signal,8,19170.5,0.015,11,0.6929146413935579
OCONNOR DR AT ST CLAIR AVE (PX 447),Major Arterial,Traffic Signal,3,24201.0,0.015,11,0.20583116605979918
CULNAN AVE AT THE QUEENSWAY,Major Arterial,No Control,7,15348.0,0.015,11,0.7573025877137608
GERRARD ST E AT VICTORIA PARK AVE,Minor Arterial,No Control,2,15917.0,0.015,11,0.2086373081113778
LAKE SHORE BLVD W AT ROYAL YORK RD,Major Arterial,No Control,5,9782.0,0.015,11,0.8487221511983236
GLENDALE AVE AT THE QUEENSWAY (PX 1879),Major Arterial,No Control,5,13910.0,0.015,11,0.5968511921654925
DUFFERIN ST AT 60M S OF HUNTER (PX 1271),Major Arterial,No Control,5,13220.0,0.015,11,0.6280030319986385
RICHMOND ST AT YORK ST (PX 74),Major Arterial,Traffic Signal,2,10341.0,0.015,11,0.3211372239830578
BAYVIEW AVE AT CITATION DR & EMPRESS AVE (PX 649),Major Arterial,No Control,5,21722.0,0.015,11,0.38220237929389567
WELLINGTON ST AT YORK ST (PX 71),Minor Arterial,Traffic Signal,5,6152.8,0.015,11,1.349336900764205
DON VALLEY PKWY W TCS AT YORK MILLS RD,None,No Control,10,17455.2,0.015,11,0.9512580873346627
OLD WESTON RD AT ROWNTREE AVE,Minor Arterial,No Control,1,8182.0,0.015,11,0.20293815895922762
ANNETTE ST AT PACIFIC AVE (PX 1880),Minor Arterial,Traffic Signal,2,8574.0,0.015,11,0.38731980793198045
BLOOR ST W AT OAKMOUNT RD,Major Arterial,No Control,2,11011.0,0.015,11,0.3015965882489148
JAMESON AVE AT LAKE SHORE BLVD W/B (PX 224),Major Arterial,No Control,16,22196.125,0.015,11,1.1969224477547502
EGLINTON AVE W AT ROYAL YORK RD,Major Arterial,Traffic Signal,4,20780.0,0.015,11,0.31962271734444664
ARLETA AVE AT NORTHOVER ST & SHEPPARD AVE (PX 1010),Collector,Stop Sign,5,16948.0,0.015,11,0.48986311559015816
BAYVIEW AVE AT SHEPPARD AVE (PX 648),Major Arterial,Traffic Signal,14,48266.142857142855,0.015,11,0.4816245686187337
ALLARD AVE AT WILSON AVE,Major Arterial,Stop Sign,3,12209.0,0.015,11,0.40800393560596293
HUMBERSIDE AVE AT KEELE ST (PX 1729),Major Arterial,Traffic Signal,3,10601.0,0.015,11,0.4698915243668711
BAYVIEW AVE AT BOWAN CRT & GLENELIA AV,Major Arterial,Stop Sign,3,18015.0,0.015,11,0.27650957811896754
BEACONHILL RD AT KIPLING AVE (PX 1651),Major Arterial,Traffic Signal,3,8346.0,0.015,11,0.5968511921654925
DONLANDS AVE AT MILLWOOD RD & PAPE AVE (PX 642),Major Arterial,No Control,8,15221.375,0.015,11,0.8726885798973616
BLOOR ST W AT KEELE ST & PARKSIDE DR (PX 328),Major Arterial,Traffic Signal,5,23322.2,0.015,11,0.35597842755065995
KENNEDY RD AT ST CLAIR AVE (PX 475),Major Arterial,No Control,12,19024.666666666668,0.015,11,1.047339254262158
LAKE SHORE BLVD AT ONTARIO DR & REMEMBRANCE DR (PX 930),Major Arterial,Traffic Signal,7,24681.0,0.015,11,0.4709323008075362
BURNHAMTHORPE RD AT HIGHWAY 427 E TCS (PX 949),Major Arterial,Traffic Signal,4,24753.5,0.015,11,0.26831599840093723
BATHURST ST AT CARPENTER RD,Major Arterial,No Control,4,15241.0,0.015,11,0.43578243333230116
STEELES AVE W AT CONLEY ST & HIDDEN TRL,Major Arterial,Traffic Signal,2,23923.0,0.015,11,0.13881536735396066
ALBION RD AT WALSH AVE & WESTON RD (PX 587),Major Arterial,Traffic Signal,6,18061.0,0.015,11,0.5516106583038815
DUNDAS ST AT KINGSWAY MILLS PLAZA (PX 1852),Major Arterial,Traffic Signal,2,16251.0,0.015,11,0.2043492728575965
BLOOR ST AT SOUTH KINGSWAY & RIVERVIEW GARDENS (PX 334),Major Arterial,Traffic Signal,5,18126.2,0.015,11,0.45802209415222167
EGLINTON AVE AT 35M E OF DONLEA DR & LEASIDE HIGH SCHOOL(PX 1125),Major Arterial,Traffic Signal,2,19138.0,0.015,11,0.17352283588717735
KEELE ST AT LAWRENCE AVE (PX 428),Major Arterial,No Control,18,29759.333333333332,0.015,11,1.0043208953677012
HULLRICK DR AT HUMBERWOOD BLVD,Collector,No Control,6,4783.0,0.015,11,2.0829270540720053
LAWRENCE AVE AT YONGE ST (PX 55),Major Arterial,Traffic Signal,7,26014.285714285714,0.015,11,0.44679605059646127
ANNETTE ST AT KEELE ST (PX 576),Major Arterial,Traffic Signal,10,17559.0,0.015,11,0.9456347266953701
SPADINA AVE AT ST ANDREWS ST (PX 1146),Major Arterial,Traffic Signal,4,9698.0,0.015,11,0.6848587406081256
AUKLAND RD AT DUNDAS ST (PX 1350),Major Arterial,Traffic Signal,2,23263.0,0.015,11,0.14275373052524612
CUMMER AVE AT DREWRY AVE & YONGE ST (PX 129),Major Arterial,No Control,3,27878.333333333332,0.015,11,0.1786806976677181
KINGSTON RD AT WARDEN AVE,Major Arterial,Traffic Signal,6,12696.666666666666,0.015,11,0.7846657993929956
HOMEWOOD AVE AT WELLESLEY ST E,Minor Arterial,Traffic Signal,2,6446.0,0.015,11,0.515184615763078
ATTWELL DR AT DIXON RD & SKYWAY AVE (PX 953),Major Arterial,No Control,8,23803.0,0.015,11,0.5580607542257364
ELMWOOD AVE AT NORTH YORK BLVD & YONGE ST (PX 1099),Major Arterial,No Control,9,26555.0,0.015,11,0.5627550423437997
EASTDALE AVE AT SECORD AVE,Collector,No Control,6,4280.0,0.015,11,2.3277196494454206
BRIAR HILL AVE AT SHERWOOD AVE & YONGE ST (PX 482),Major Arterial,No Control,9,16954.0,0.015,11,0.8814415565317685
ALBION RD AT CALSTOCK DR (PX 1921),Major Arterial,No Control,2,12543.0,0.015,11,0.264759629531117
1630 LAWRENCE AVE W AT 55M E OF OLYMPIA DR (PX 1624),Major Arterial,Traffic Signal,2,18320.0,0.015,11,0.18127074417078604
BRIMLEY RD AT HUNTINGWOOD DR (PX 1170),Major Arterial,No Control,6,15832.333333333334,0.015,11,0.629259117394345
QUEEN ST E AT RIVER ST,Major Arterial,Traffic Signal,3,6185.0,0.015,11,0.8053872352163622
FINCH AVE E AT BRAHMS AVE & LINUS RD,Major Arterial,Traffic Signal,2,12965.0,0.015,11,0.25614192311676054
FINCH AVE AT TOBERMORY DR (PX 1002),Major Arterial,Traffic Signal,4,16547.0,0.015,11,0.401387566714063
BAYVIEW AVE AT BAYVIEW MEWS LANE (PX 1147),Major Arterial,Traffic Signal,8,23559.5,0.015,11,0.5638286098107006
KENNEDY RD AT RANSTONE GDNS (PX 1762),Major Arterial,Traffic Signal,3,13221.0,0.015,11,0.3767733189481281
FINCH AVE AT 35M E OF WINLOCK PK (PX 1780),Major Arterial,No Control,3,16398.0,0.015,11,0.30377607329023054
EMPRESS AVE AT PARK HOME AVE & YONGE ST (PX 126),Major Arterial,Traffic Signal,11,21313.0,0.015,11,0.8569811937619481
BROCK AVE AT COLLEGE ST (PX 1153),Minor Arterial,Traffic Signal,4,11612.0,0.015,11,0.5719738259057527
MURRAY RD AT WILSON AVE (PX 2429),Major Arterial,No Control,3,16702.0,0.015,11,0.2982469195194109
MERTON ST AT MOUNT PLEASANT RD,Major Arterial,Traffic Signal,6,19701.0,0.015,11,0.5056921019047969
LAWRENCE AVE AT SOUTH STATION ST,Local,No Control,2,10839.0,0.015,11,0.3063825106752284
CLOSE AVE AT KING ST W,Major Arterial,Pedestrian Crossover,7,9237.0,0.015,11,1.2583176481791494
THE QUEENSWAY AT SOUTHPORT ST,Major Arterial,No Control,2,15067.0,0.015,11,0.22040751531219224
COLBECK ST AT WINDERMERE AVE,Collector,Stop Sign,2,2703.0,0.015,11,1.2285904673358492
BANBURY RD AT LAWRENCE AVE E,Collector,No Control,1,8811.0,0.015,11,0.1884508020207014
LAWRENCE AVE E AT MORNINGSIDE AVE,Minor Arterial,No Control,8,15316.0,0.015,11,0.8672969530448683
GERRARD ST E AT WOODBINE AVE (PX 365),Major Arterial,Traffic Signal,5,15209.4,0.015,11,0.545859802689258
BURNHAMTHORPE RD AT KIPLING AVE (PX 726),Major Arterial,No Control,2,20308.0,0.015,11,0.1635257057912547
ANGLESEY BLVD AT THE KINGSWAY,Collector,Stop Sign,2,4296.0,0.015,11,0.773016767506704
DALLNER RD AT WILSON AVE,Major Arterial,Stop Sign,4,14988.0,0.015,11,0.44313851524003206
BROADWAY AVE AT REDPATH AVE,Collector,Stop Sign,2,6290.0,0.015,11,0.5279618494767568
DALESFORD RD AT ROYAL YORK RD & SINCLAIR ST,None,No Control,7,8722.0,0.015,11,1.3326163857178173
WILSON AVE AT BILLY BISHOP WAY & TRANSIT RD,Major Arterial,Traffic Signal,3,22437.666666666668,0.015,11,0.22200704395049398
SHEPPARD AVE E AT HWY 404 N & YORKLAND RD (PX 747),Major Arterial,Traffic Signal,5,36065.0,0.015,11,0.23020102822742272
MAXWELL ST AT SEARLE AVE,Local,No Control,2,797.0,0.015,11,4.166725261240653
COLLEGE ST AT MARKHAM ST,Major Arterial,Stop Sign,2,9102.0,0.015,11,0.3648516845977588
RANEE AVE AT VARNA DR (PX 2355),None,No Control,1,5500.0,0.015,11,0.3018981848371637
MARTIN GROVE RD AT RICHGROVE DR (PX 1873),Major Arterial,Traffic Signal,3,12108.0,0.015,11,0.41140733810812685
DAVISVILLE AVE AT MOUNT PLEASANT RD,Minor Arterial,No Control,4,15171.0,0.015,11,0.4377931623767452
BLOSSOMFIELD DR AT LAWRENCE AVE W,Collector,Stop Sign,2,15440.0,0.015,11,0.21508290370523317
FRONT ST E AT LOWER JARVIS ST & JARVIS ST,Major Arterial,No Control,3,16158.0,0.015,11,0.30828815755744526
DUNDAS ST E AT  MUTUAL ST,Major Arterial,No Control,2,10496.0,0.015,11,0.31639482023711896
COXWELL AVE AT EARL HAIG AVE,Minor Arterial,Pedestrian Crossover,2,6360.0,0.015,11,0.5221509486177359
COLLEGE ST AT UNIVERSITY AVE (PX 83),Major Arterial,Traffic Signal,6,25319.0,0.015,11,0.3934847387190016
KING ST W AT SUDBURY ST,Major Arterial,Traffic Signal,2,11412.0,0.015,11,0.2909989513852787
BAYVIEW AVE AT SUTHERLAND DR,Major Arterial,Stop Sign,2,14287.0,0.015,11,0.23244068266317636
BRAECREST AVE AT ROYAL YORK RD,Minor Arterial,No Control,1,9283.0,0.015,11,0.17886890192872998
BOTANY HILL RD AT ORTON PARK RD AND SLAN AVE,Minor Arterial,No Control,1,3604.0,0.015,11,0.4607214252509435
RENFORTH DR AT SILVER DART RD (PX 1641),Major Arterial,Traffic Signal,5,18504.0,0.015,11,0.44867056220395596
MARTIN GROVE RD AT STEELES AVE W,Major Arterial,No Control,8,19970.75,0.015,11,0.6651487867423708
AVENUE RD AND FELBRIGG AVE,Major Arterial,No Control,4,19608.0,0.015,11,0.3387270535708691
CHATHAM AVE AT HAZELWOOD AVE AND JONES AVE,Minor Arterial,Pedestrian Crossover,3,6001.0,0.015,11,0.8300816613586404
ALBION RD AT RIVERDALE DR & THISTLE DOWN BLVD (PX 1102),Major Arterial,Traffic Signal,3,14393.0,0.015,11,0.34609324323026475
MARTIN GROVE RD AT ROYALCREST RD,Minor Arterial,No Control,3,9633.0,0.015,11,0.5171099397709126
DIXON RD AT KIPLING AVE (PX 435),Major Arterial,Traffic Signal,7,21757.428571428572,0.015,11,0.5342120314481464
BRAMBLEBROOK AVE AT MCNICOLL AVE (PX 2230),Minor Arterial,No Control,2,13341.0,0.015,11,0.24892287183935244
DOURO ST AT STRACHAN AVE & WELLINGTON ST W,Minor Arterial,Stop Sign,4,12097.0,0.015,11,0.5490419167080764
CARLTON ST AT HOMEWOOD AVE,Minor Arterial,Stop Sign,4,8164.0,0.015,11,0.8135423893211171
SPADINA AVE AT SULLIVAN ST (PX 1335),Major Arterial,No Control,4,10514.0,0.015,11,0.6317063026838121
KENNEDY RD AT PERTHSHIRE ST,Major Arterial,No Control,3,15740.0,0.015,11,0.3164752255281576
COLLINGSBROOK BV AT CORINTHIAN S BLVD & PHARMACY AVE (PX 1520),Minor Arterial,Traffic Signal,2,7100.0,0.015,11,0.46772958214208454
DON MILLS RD AT FRESHMEADOW DR,Major Arterial,No Control,2,13519.0,0.015,11,0.2456453904289371
BRIMORTON DR AT MARKHAM RD (PX 703),Major Arterial,Traffic Signal,4,18477.0,0.015,11,0.35946095504776754
BIRMINGHAM ST AT KIPLING AVE (PX 767),Collector,No Control,4,9398.5,0.015,11,0.7066829883936374
DEERFOOT RD AT ISLINGTON AVE (PX 2446),Major Arterial,No Control,3,14738.0,0.015,11,0.3379915897552721
BLOOR ST W AT OSSINGTON AVE (PX 341),Major Arterial,No Control,9,15367.777777777777,0.015,11,0.9724216712092866
WARDEN AVE AT 260M N OF BERTRAND & MULTI USE TRAIL (PX 2147),Major Arterial,Traffic Signal,2,14912.0,0.015,11,0.22269850008106226
COXWELL AVE AT DUNDAS ST E,Minor Arterial,No Control,1,10409.0,0.015,11,0.1595196480549909
KEELE ST AT MAPLE LEAF DR (PX 594),Major Arterial,No Control,3,20078.0,0.015,11,0.24809841865789423
BATHURST ST AT RICHMOND ST W,Major Arterial,Traffic Signal,3,12964.0,0.015,11,0.3842425215838631
ELLESMERE RD AT MIDLAND AVE,Major Arterial,Traffic Signal,15,29632.466666666667,0.015,11,0.840517278876525
LAWRENCE AVE W AT W R ALLEN RD NORTHBOUND ON RAMP,Major Arterial,Traffic Signal,7,24195.285714285714,0.015,11,0.4803861485036378
BLOOR ST W AT SHAW ST (PX 323),Major Arterial,No Control,3,11987.0,0.015,11,0.41556019436165853
MARTIN GROVE RD AT RATHBURN RD (PX 879),Minor Arterial,Traffic Signal,6,10081.0,0.015,11,0.9882591111622261
FINCH AVE W AT SENLAC RD (PX 812),Major Arterial,No Control,2,17047.0,0.015,11,0.1948072994197689
INNISDALE DR AT PHARMCAY AVE (PX 2227),Minor Arterial,Traffic Signal,2,11802.0,0.015,11,0.28138281928561265
BRIDLETOWNE CIR E AT FINCH AVE E,Major Arterial,Traffic Signal,2,17966.0,0.015,11,0.18484248208887905
GLAMORGAN AVE AT KENNEDY RD & PROGRESS AVE (PX 692),Major Arterial,Traffic Signal,8,23886.5,0.015,11,0.5561099421361523
BIRCHMOUNT RD AT FINCH AVE E (PX 1138),Major Arterial,Traffic Signal,2,27767.0,0.015,11,0.11959808525259484
LAWRENCE AVE E AT ORTON PARK RD (PX 858),Major Arterial,Traffic Signal,6,13720.0,0.015,11,0.7261399489523616
VICTORIA PARK AVE AT YORK MILLS RD,Major Arterial,Traffic Signal,4,21588.0,0.015,11,0.3076598140827127
FINCH AVE E AT MARKHAM RD,Major Arterial,Traffic Signal,15,30418.0,0.015,11,0.8188112383807615
BERKELEY ST AT QUEEN ST E,Major Arterial,No Control,2,6294.0,0.015,11,0.5276263160484271
BAYVIEW AVE AT STEELES AVE E,Major Arterial,No Control,4,38063.5,0.015,11,0.17449157503691465
ISLINGTON AVE AT THE WESTWAY (PX 711),Major Arterial,Traffic Signal,4,20743.0,0.015,11,0.32019283933942055
CRAIGTON DR & JONESVILLE CR AT VICTORIA PARK AVE (PX 202),Major Arterial,No Control,4,18934.5,0.015,11,0.35077557191463205
EGLINTON AVE W AT MARTIN GROVE RD,Major Arterial,Traffic Signal,15,33744.0,0.015,11,0.7381045593013871
MILLWICK DR AT PLUNKETT RD (PX 1632),Minor Arterial,Traffic Signal,2,5621.0,0.015,11,0.590798796158833
ASHTONBEE ROAD AT HAKIMI AVE (PX 2069),Local,Stop Sign,5,7934.0,0.015,11,1.0464078753493824
ELLESMERE RD AT MILITARY TR W & ORTON PARK RD,Major Arterial,Traffic Signal,4,14792.0,0.015,11,0.44901028031487294
ARLINGTON AVE AT ST CLAIR AVE (PX 1024),Major Arterial,Traffic Signal,5,10063.0,0.015,11,0.8250223673876579
KING ST W AT TYNDALL AVE,Major Arterial,Stop Sign,2,5766.0,0.015,11,0.5759417331267431
HOMEWOOD AVE AT MAITLAND PL,Collector,Stop Sign,4,1997.0,0.015,11,3.325868836463496
REINER RD AT WILSON HEIGHTS BLVD (PX 1140),Minor Arterial,Traffic Signal,4,16284.0,0.015,11,0.40787030621577014
MCNICOLL AVE AT WARDEN AVE (PX 1287),Major Arterial,No Control,7,22704.428571428572,0.015,11,0.5119300879854504
ISLINGTON AVE AT THE KINGSWAY (PX 708),Major Arterial,No Control,3,18203.0,0.015,11,0.2736537960673076
COMBERMERE DR AT VICTORIA PARK AVE (PX 2344),Major Arterial,No Control,18,20136.0,0.015,11,1.484302756201788
EAST DR AT JANE ST & OUTLOOK AVE (PX 526),Major Arterial,Traffic Signal,3,15421.0,0.015,11,0.3230218565471241
APEX RD AT GOOD SHEPHERD CRT & LAWRENCE AVE(PX 1707),Major Arterial,Traffic Signal,2,15458.0,0.015,11,0.21483245136555829
DANFORTH AVE AT DAWES RD,Major Arterial,No Control,3,12259.0,0.015,11,0.4063398360235909
WILLIAM CRAGG DR AT WILSON AVE (PX 2372),Major Arterial,No Control,2,14968.0,0.015,11,0.22186531488567612
ARROW RD & SIGNET DR AT FINCH AVE W (PX 810),Major Arterial,No Control,15,31914.0,0.015,11,0.7804286598065427
HALFWAY AVE AT MORNINGSIDE AVE,Minor Arterial,No Control,8,9737.0,0.015,11,1.3642312963782688
ELLESMERE RD AT HELICON GT & SCARBOROUGH GOLF CLUB RD,Major Arterial,Traffic Signal,3,13185.0,0.015,11,0.37780205155959046
FINCH AVE AT TALBOT RD (PX 1206),Major Arterial,No Control,2,16972.0,0.015,11,0.19566816127791659
MARCELLA ST AT SCARBOROUGH GOLF CLUB RD (PX 2228),Local,Stop Sign,6,5375.0,0.015,11,1.8535144371397956
LAKE SHORE BLVD W AT LONG BRANCH AVE (PX 240),Major Arterial,No Control,3,10930.666666666666,0.015,11,0.4557196922859113
CONLINS RD & SHEPPARD AVE E,Collector,No Control,3,12823.0,0.015,11,0.3884676011708025
NEWCASTLE ST AT ROYAL YORK RD,Minor Arterial,Traffic Signal,2,8258.0,0.015,11,0.40214095824761453
BATHURST ST AT FORT YORK BLVD (PX 1919),Major Arterial,Traffic Signal,14,12745.285714285714,0.015,11,1.8239026376949596
BAY ST AT WELLINGTON ST (PX 60),Major Arterial,Traffic Signal,14,15505.857142857143,0.015,11,1.4991857604705248
FINCH AVE AT PELICAN GT,Major Arterial,No Control,2,27997.0,0.015,11,0.11861556713965071
MCNICOLL AVE AT MIDDLEFIELD RD (PX 1582),Minor Arterial,No Control,6,16372.666666666666,0.015,11,0.608492208536162
GLENHURST AVE AT OAKWOOD AVE,Minor Arterial,No Control,2,7879.0,0.015,11,0.42148496423515674
LONSDALE RD AT ORIOLE PKWY,Major Arterial,No Control,2,613.0,0.015,11,5.417422566409137
BROCK AVE AT DUNDAS ST W,Minor Arterial,Traffic Signal,4,9166.5,0.015,11,0.7245688175876943
BEACONSFIELD AVE AT QUEEN ST W,Major Arterial,No Control,3,11352.0,0.015,11,0.43880550121680767
